729317,https://www.airbnb.com/rooms/729317,20230309202119,2023-03-09,city scrape,Suite 2 Stay - studio Beautiful Barok - canal area,"Onze twee appartementen bieden een fijne basis om te genieten van alle bijzonderheden die Amsterdam te bieden heeft. Je beschikt over een fijne studio met alle faciliteiten privé.<br /><br />Ons huis is gelegen in de wereldbekende grachtengordel in Amsterdam centrum vlakbij het Leidseplein, Rembrandtplein, Museumplein, Anne Franks museum, Rijksmuseum en van Gogh museum. Je zult genieten van ons huis vanwege de fijne voorzieningen, de locatie en de ervaring om als inwoner van Amsterdam te leven.<br /><br /><b>The space</b><br />De ruimte betreft een privé studio van ca. 30m2 op de eerste verdieping. In de studio vind je alle voorzieningen die je nodig hebt voor een fantastisch verblijf: <br />- een queen size bed<br />- een tv met dvd combinatie<br />- een bank om op te relaxen<br />- een eettafel<br />- een kitchenette met koelkast, magnetron en keukenspullen <br />- een badkamer met toilet, wastafel en regendouche.<br /><br /><b>Guest access</b><br />De gasten betreden ons huis door d","Indien je Amsterdam bezoekt, dan is een verblijf in de grachtengordel de ultieme ervaring. De stad is het beste lopend of fietsend te verkennen. <br /><br />Ons huis bevindt zich in een rustig straatje in Amsterdam centrum in de beroemde grachtengordel. De locatie is perfect omdat je binnen 15 minuten loopafstand bevindt van bekende plekken als het Leidseplein, het Rembrandtplein, het Museumplein, de Albert Cuyp markt en het Vondelpark. Ook bekende musea als het Anne Frank-, het van Gogh- en het Rijksmuseum zijn binnen 15 minuten lopend te bereiken.",https://a0.muscache.com/pictures/miso/Hosting-729317/original/dde7ec20-a4d6-44fb-8200-2e80f5c43bd9.jpeg,3788673,https://www.airbnb.com/users/show/3788673,Laurens En Petra,2012-10-07,"Amsterdam, Netherlands",.,within an hour,100%,100%,f,https://a0.muscache.com/im/users/3788673/profile_pic/1365436673/original.jpg?aki_policy=profile_small,https://a0.muscache.com/im/users/3788673/profile_pic/1365436673/original.jpg?aki_policy=profile_x_medium,Grachtengordel,2,2,['phone'],t,t,"Amsterdam, North Holland, Netherlands",Centrum-Oost,,52.36052,4.89568,Private room in bed and breakfast,Private room,2,,1 private bath,1.0,1.0,"[""Wifi"", ""Hangers"", ""Kitchen"", ""Private living room"", ""Self check-in"", ""Lockbox"", ""Iron"", ""Refrigerator"", ""Hair dryer"", ""Hot water"", ""Private entrance"", ""Shampoo"", ""Heating"", ""Microwave"", ""Lock on bedroom door"", ""Coffee maker"", ""Dishes and silverware"", ""Essentials"", ""TV with standard cable"", ""Smoke alarm""]",$129.00,3,14,1,4,1125,1125,3.5,1125.0,,t,7,12,14,32,2023-03-09,126,35,0,2017-04-08,2023-02-05,4.64,4.75,4.57,4.85,4.75,4.82,4.54,0363 EC5F 15FE 498F 9173,t,2,0,2,0,1.75
730916,https://www.airbnb.com/rooms/730916,20230309202119,2023-03-09,city scrape,Bed & Breakfast in Oud West Area,"Your room is situated in a groundfloor apartment, a quiet place with a beautifull view, canoe  use, optional, waterfront/swimming. It is a 10 minutes walk to the Jordaan (Centre). Nearby you will find many little restaurants and terraces. The house and neighbourhood is still quiet and peacefull neighbourhood and we like to keep it that way, so 'party animals' this is not the place. We offer thai massage. Breakfast included. After 22:00 o clock please respect tranquility and silence in the house.<br /><br /><b>The space</b><br />A- Big private room in a ground floor apartment with unique view waterfront. Tony & Santi live in the same apartment. Also from your bedroom you have a nice view over the garden and water. Very quiet though at walking distance from the Jordaan, Anna Frank House and City Center. <br />- Bathroom and toilet are shared with owner. Towels are available.<br />- You can make use of the kitchen for breakfast, equipped with, microwave, coffee machine. You'll find your b",We are neighbouring the unique quarter Jordaan (part of the Centre) for quiet walks. From cross de Clerquestraat/Bilderdijkstraat you can take tram 3 or 12 to the museum district. In 10 minutes you are there. Or 25 minutes walking.,https://a0.muscache.com/pictures/9978249/60b2a3ea_original.jpg,3267693,https://www.airbnb.com/users/show/3267693,Santiago & Tony,2012-08-15,"Amsterdam, Netherlands","Welcome to Amsterdam
",within an hour,100%,100%,t,https://a0.muscache.com/im/users/3267693/profile_pic/1381082945/original.jpg?aki_policy=profile_small,https://a0.muscache.com/im/users/3267693/profile_pic/1381082945/original.jpg?aki_policy=profile_x_medium,Frederik Hendrikbuurt,2,2,"['email', 'phone']",t,t,"Amsterdam, North Holland, Netherlands",Westerpark,,52.3731,4.86859,Private room in rental unit,Private room,2,,1 shared bath,1.0,1.0,"[""Canal view"", ""Wifi"", ""Hangers"", ""Kitchen"", ""Lake access"", ""Iron"", ""Washer"", ""Hair dryer"", ""Breakfast"", ""Heating"", ""Dishes and silverware"", ""Essentials"", ""TV with standard cable""]",$95.00,3,90,3,3,1125,1125,3.0,1125.0,,t,5,14,21,141,2023-03-09,403,39,2,2012-11-19,2023-02-26,4.75,4.86,4.8,4.9,4.87,4.73,4.67,0363 AC47 89D1 F988 70CA,f,1,0,1,0,3.21
733654,https://www.airbnb.com/rooms/733654,20230309202119,2023-03-10,previous scrape,FAMILY HOME WITH SUNNY PRIVATE GARDEN IN CENTER,"FAMILY HOME WITH GARDEN! ENJOY CITY LIFE IN DOWNTOWN AMSTERDAM ON WALKING DISTANCE; AND RELAX IN THE (PRIVATE) LARGE SUNNY GARDEN OF OUR MODERN, BRIGHT AND SPACIOUS APARTMENT, IN A QUIET AREA IN THE CENTER.<br />Couples with children are very welcome!<br /><br /><b>The space</b><br />Big, very bright almost 100m2(!!) apartment IN THE CENTER of Amsterdam, with sunny garden of 80m2!!!<br /><br />In short: <br />- SUNNY LARGE GARDEN!!!!<br />- PLEASE NOTE: WE HAVE TWO CUTE CATS THAT NEED YOUR CARE DURING YOUR STAY!<br />- Nice bright space<br />- Master bedroom with double bed <br />- Second smaller bedroom with childrens bed, and sofabed, on request. <br />- Extra single sofabed in livingroom, on request.<br />- Extra double airbed in smaller room is possible, on request.<br />- Babybed and high-chair available. (as well as loads of toys)<br />- Modern open kitchen with all basic equipment (dishwasher, stove, fridge, freezer, oven, microwave, espressomachine etc) <br />- Large modern bat","Quiet central area with lots of green, on walking distance to Central Station",https://a0.muscache.com/pictures/miso/Hosting-733654/original/49acb48a-b923-4233-af23-ac769653a20a.jpeg,3823268,https://www.airbnb.com/users/show/3823268,Geerke,2012-10-10,"Amsterdam, Netherlands","Hi, 

We are Has and Geerke, a social entrepreneur and a creative director from Amsterdam. We have an 11 year old daughter called Sammie, a 7 year old son called Nino, and 2 cats.
We live in a bright 95m2 apartment in a quiet area of the city center, with a 80m2 garden on the sunny south side, with terrace and lots of green.
Amsterdam is a very warm and exciting city.....we are sure that you will enjoy your stay!!!!",,,100%,f,https://a0.muscache.com/im/pictures/user/70e370f3-6c95-4bf3-9376-ce743ec09c83.jpg?aki_policy=profile_small,https://a0.muscache.com/im/pictures/user/70e370f3-6c95-4bf3-9376-ce743ec09c83.jpg?aki_policy=profile_x_medium,Oostelijke Eilanden en Kadijken,1,1,"['email', 'phone']",t,t,"Amsterdam, North Holland, Netherlands",Centrum-Oost,,52.37098,4.9227,Entire rental unit,Entire home/apt,4,,1.5 baths,2.0,2.0,"[""Wifi"", ""Washer"", ""Hair dryer"", ""Outdoor furniture"", ""Private backyard \u2013 Fully fenced"", ""Cooking basics"", ""Single level home"", ""High chair"", ""Kitchen"", ""Baby bath"", ""Dedicated workspace"", ""Children\u2019s books and toys"", ""Stove"", ""Shampoo"", ""Babysitter recommendations"", ""Outlet covers"", ""Coffee maker"", ""Essentials"", ""Dishes and silverware"", ""Smoke alarm"", ""Outdoor dining area"", ""Bathtub"", ""Iron"", ""Private entrance"", ""Heating"", ""Dishwasher"", ""Fire extinguisher"", ""First aid kit"", ""Hangers"", ""Oven"", ""Dryer"", ""Refrigerator"", ""Microwave"", ""Hammock""]",$168.00,5,30,5,5,30,30,5.0,30.0,,t,0,0,0,0,2023-03-10,12,2,0,2012-12-27,2022-08-13,5.0,4.92,4.83,4.83,5.0,4.92,4.83,0363 14BA 84A0 A482 3B0B,f,1,1,0,0,0.1
690757,https://www.airbnb.com/rooms/690757,20230309202119,2023-03-09,city scrape,SPACIOUS LOFT in 17C CANAL MANSION,"PLEASE READ TEXT GOOD !! <br /><br />IN THE HEART OF AMSTERDAM<br /><br />your room of 80 m2 part of our private house the 17th Century MAGAZIJN<br /><br /><b>The space</b><br />PLEASE READ TEXT GOOD !! <br /><br />IN THE HEART OF AMSTERDAM<br /><br />your room is 80 m2 part of the 17th Century MAGAZIJN <br /><br />You are sleeping in the heart of Amsterdam in our huge  (350m2) 17th century fabric storage. We live here now for 3 years and combine the house for living and contemporary art, fashion and design events.  <br /><br />Your 80 m2 room, which is one entire floor of the house,  is turned into a contemporary art librairy. As this old house has only one bathroom You have to share…..Because the house is located between two canals it is extremly quiet in the most busy area of Amsterdam… Complete silence..<br /><br />1 double bed, 1 single bed ( 3 persons is MAX)<br />THE ROOM IS NON-SMOKING but we have a very nice SMOKING AREA in the PATIO<br /><br />Only 2 minutes from Dam Square, ",,https://a0.muscache.com/pictures/10997524/330cc9dc_original.jpg,3529778,https://www.airbnb.com/users/show/3529778,Gijs,2012-09-10,"Amsterdam, Netherlands","You are welcome in our Big Family House! 

So many books because I used to be an Artbook Publishers (Artimo & Veenman Publishers) for many years till 2008. I published lots of great Art books but also Design, Fashion and Architecture books and magazines. 

Since 2008 I am a art curator again. Being the Curator for Contemporary Art at the Keukenhof Castle ( a 17th Century Castle near Amsterdam see: (website hidden)) from 2008-2014 Then i am the owner and curator of SALON/ : an art/fashion/design route in Amsterdam, Cape Town, Aruba, Maastricht and Istanbul beijing etc. Now working on the new space XBANK in W hotel and a new Design Museum. 

We like to share so our house is a warm welcome to lots of people we like to host as guests but also for exhibitions, special dinners, house concerts etc. ( for shows and events  in our place see : (website hidden))

We love to live in the center of Amsterdam. Everything on walking distance. 
Enjoy Amsterdam as a cosy village with the allure of a Metropolis. 

And meet the Family: my partner Angelo ( cultural attache for Aruba in The Hague) and the twins Anna & Helena (20 years) ",within an hour,100%,100%,f,https://a0.muscache.com/im/users/3529778/profile_pic/1348417558/original.jpg?aki_policy=profile_small,https://a0.muscache.com/im/users/3529778/profile_pic/1348417558/original.jpg?aki_policy=profile_x_medium,De Wallen,4,6,"['email', 'phone']",t,t,,Centrum-West,,52.374,4.89902,Private room in loft,Private room,3,,1.5 shared baths,1.0,2.0,"[""Host greets you"", ""Free washer \u2013 In building"", ""Wifi"", ""Waterfront"", ""Hair dryer"", ""Outdoor furniture"", ""Hot water"", ""Cooking basics"", ""Dedicated workspace"", ""Shampoo"", ""Babysitter recommendations"", ""Coffee maker"", ""Essentials"", ""Smoke alarm"", ""Iron"", ""Free dryer \u2013 In building"", ""Heating"", ""Shared patio or balcony"", ""Fire extinguisher"", ""First aid kit"", ""Crib"", ""Refrigerator"", ""Pack \u2019n play/Travel crib"", ""Pets allowed""]",$185.00,2,1125,2,2,1125,1125,2.0,1125.0,,t,3,5,12,214,2023-03-09,517,68,6,2012-10-08,2023-03-08,4.52,4.58,4.46,4.76,4.68,4.89,4.43,0363 92E1 9539 83BB 3AA7,t,2,0,2,0,4.08
693675,https://www.airbnb.com/rooms/693675,20230309202119,2023-03-10,city scrape,2 rooms in beautiful appartment near Vondelpark,"Two nice bedrooms for two people, prefearably to one party, for example two friends sleeping seperately. With a shared bathroom and a separate own toilet. The rooms are light and one has a big balcony overlooking gardens. Coffee- and teamachine included.<br /><br /><b>The space</b><br />We offer 2 nice rooms with each a big bed for one. A shared bathroom and a separate own toilet. The rooms are light and one has a big balcony. The house is in a very green area, very central and is ideal for an uncomplicated stay in Amsterdam.  Have a look at the pictures to get an impression. <br /><br />The house is in a lively but small neighbourhood, very near Rembrandtpark and Vondelpark, 5 minutes on foot to the Overtoom with cafes and restaurants in abundance.<br /><br />Public transport: trams 1, 17 and bus 15 stop within 200 meters of the appartment, 20 minutes to Damsquare (!). Public transport to Schiphol Airport takes about 30 minutes.<br /><br />I or a friend will be present when you arrive",,https://a0.muscache.com/pictures/2a0766cc-c557-41ae-b387-5daf6eda0473.jpg,3548522,https://www.airbnb.com/users/show/3548522,Susanne,2012-09-12,"Amsterdam, Netherlands","I am a 50 year landlady, choreographer, wife and mother, busy working in theater and schools, and love to have friends over.",within a day,100%,22%,f,https://a0.muscache.com/im/users/3548522/profile_pic/1347469481/original.jpg?aki_policy=profile_small,https://a0.muscache.com/im/users/3548522/profile_pic/1347469481/original.jpg?aki_policy=profile_x_medium,Oud-West,3,3,"['email', 'phone']",t,t,,De Baarsjes - Oud-West,,52.35925,4.8514,Entire rental unit,Entire home/apt,2,,1 bath,2.0,2.0,"[""Host greets you"", ""Wifi"", ""Washer"", ""Hair dryer"", ""Luggage dropoff allowed"", ""Hot water"", ""Cooking basics"", ""Kitchen"", ""Stove"", ""Shampoo"", ""Coffee maker"", ""Essentials"", ""Dishes and silverware"", ""Smoke alarm"", ""Iron"", ""Dishwasher"", ""Heating"", ""Private patio or balcony"", ""TV with standard cable"", ""Fire extinguisher"", ""Carbon monoxide alarm"", ""Hangers"", ""Oven"", ""Dryer"", ""Refrigerator"", ""Microwave""]",$95.00,1,4,1,1,4,4,1.0,4.0,,t,0,0,0,0,2023-03-10,11,0,0,2014-01-03,2018-09-02,4.73,4.55,5.0,4.82,4.9,4.55,4.64,0363 8350 2AA2 28A1 C258,f,3,2,1,0,0.1
696113,https://www.airbnb.com/rooms/696113,20230309202119,2023-03-09,city scrape,Fabulous design at the park.,"Wonderful apartment with a wide view.<br />All my guests had wonderful times. <br />15 mins by tram to Central Station.<br />Take a break from the busy center; stroll in the park, swim in the lake or chill on the couch. See my reviews.<br />I love good communications! I get lots of requests so please make an effort in your first message. Tell me about yourself, your travelling guests, your plans for your trip.<br /><br />Morris the cat lives with me. He is fond of humans. Please take good care of my best friend.<br /><br /><b>The space</b><br />Wonderful spacious apartment with a view on the lake.<br /><br />This beautifully designed waterfront apartment is situated on a very popular new island in Amsterdam. Only ten years old it is very comfortable and a little over 100 square metres. The wide view is unique so close to the busy centre of Amsterdam. <br /><br />Located ground level means easy access to the waterfront. Start the day with a swim, excite your weekend with watersport acti","IJburg is now ten years old. It's a totally new island only 15 minutes from Central Station. It's famous for the open air, the water all around and the wildlife. A great surrounding to shelter after visiting the hectic city.",https://a0.muscache.com/pictures/0ff0ab80-fdf2-409f-b170-5e73d5724562.jpg,3564543,https://www.airbnb.com/users/show/3564543,Daniel,2012-09-14,"Amsterdam, Netherlands",Nette onderwijzer met internationale relatie is veel op pad. Ik hou van een zeer verzorgde omgeving en dank het lot voor het vinden van mijn huis. Het is hier werkelijk heerlijk wonen.,within a day,60%,0%,f,https://a0.muscache.com/im/users/3564543/profile_pic/1347606522/original.jpg?aki_policy=profile_small,https://a0.muscache.com/im/users/3564543/profile_pic/1347606522/original.jpg?aki_policy=profile_x_medium,Oost,1,1,"['email', 'phone', 'work_email']",t,t,"Amsterdam, North Holland, Netherlands",IJburg - Zeeburgereiland,,52.36158,4.97639,Entire rental unit,Entire home/apt,4,,1 bath,2.0,4.0,"[""Wifi"", ""Washer"", ""Outdoor furniture"", ""Hot water"", ""Garden view"", ""Kitchen"", ""Park view"", ""Coffee maker"", ""Paid parking off premises"", ""Essentials"", ""Smoke alarm"", ""Dishes and silverware"", ""Elevator"", ""Iron"", ""Lake view"", ""Heating"", ""Private patio or balcony"", ""Backyard"", ""Marina view"", ""Hangers"", ""Smoking allowed"", ""Refrigerator""]",$211.00,7,21,4,7,21,21,6.9,21.0,,t,0,8,14,78,2023-03-09,21,0,0,2012-10-28,2018-01-01,4.76,4.9,4.81,4.95,4.7,4.57,4.76,0363 E46F 1FD2 518B BF66,f,1,1,0,0,0.17
740616,https://www.airbnb.com/rooms/740616,20230309202119,2023-03-09,city scrape,Private Room at our LoveNest in Amsterdam,"We host in 1 of our 2 rooms. We sleep in the other one.  Your room has a very comfy double bed and a closet. The apartment is very well located, walking distance from most attractions, and it is well connected to public transport (50mts from metro and tram). We are a couple, very friendly and relaxed. World travelers ourselves, with a lot of experience in home staying both as guests and hosts. We are always glad to help, share and respect your time and space.<br /><br /><b>The space</b><br />In the spirit of shared economy, we share our real home. It has our positive, loving vibes. It is also in the centre but in a quiet area. Our apartment is in the second floor of a stylish old-Amsterdam building. It is located in a very cool neighborhood full with restaurants, cafes, and very close to parks, street markets, museums, university, botanical garden, local brewery, Amstel river... where you can enjoy the daily routine of the city (which has much more to offer than the typical highlights)","It is located in a very cool neighborhood full with restaurants, cafes, and very close to parks, street markets, museums, university, botanical garden, local brewery, Amstel river... where you can enjoy the daily routine of the city (which has much more to offer than the typical highlights) and feel as a real Amsterdammer (inhabitant of Amsterdam).",https://a0.muscache.com/pictures/10377447/a942e0ee_original.jpg,3846003,https://www.airbnb.com/users/show/3846003,Patricia And Carlos,2012-10-12,"Amsterdam, Netherlands","Young, happy, intercultural couple living in Amsterdam. Carlos is working as a scientist and Patri as an editor. We read, like wine, practice meditation, yoga and running. We enjoy multicultural environments, are very open and love to meet new people from around the world. We take good care of our plants and our guests, and so far we have no kids and no pets.

We will be traveling some times so we would like to introduce P&C friends. In our profile pictures you will see Maria, Luciano and Ana, who will take care of welcoming you in our LoveNest whenever we are away. They are very lovely people you will see.",,,,f,https://a0.muscache.com/im/users/3846003/profile_pic/1350045722/original.jpg?aki_policy=profile_small,https://a0.muscache.com/im/users/3846003/profile_pic/1350045722/original.jpg?aki_policy=profile_x_medium,Weesperbuurt en Plantage,1,3,"['email', 'phone']",t,t,"Amsterdam, North Holland, Netherlands",Centrum-Oost,,52.36256,4.9108,Private room in rental unit,Private room,1,,1 shared bath,1.0,1.0,"[""Building staff"", ""Wifi"", ""Hair dryer"", ""Luggage dropoff allowed"", ""Bed linens"", ""Hot water"", ""Cooking basics"", ""Self check-in"", ""Kitchen"", ""Pets allowed"", ""Stove"", ""Long term stays allowed"", ""Coffee maker"", ""Essentials"", ""Dishes and silverware"", ""Smoke alarm"", ""Bathtub"", ""Paid parking on premises"", ""Iron"", ""Dishwasher"", ""Heating"", ""TV with standard cable"", ""Fire extinguisher"", ""Carbon monoxide alarm"", ""Hangers"", ""Oven"", ""Refrigerator"", ""Microwave"", ""EV charger""]",$99.00,3,90,3,3,90,90,3.0,90.0,,t,0,0,0,66,2023-03-09,77,0,0,2012-10-24,2019-06-15,4.8,4.82,4.87,4.89,4.95,4.74,4.54,0363 52AD E309 9B3D 72F7,f,1,0,1,0,0.61
698672,https://www.airbnb.com/rooms/698672,20230309202119,2023-03-10,previous scrape,Cosy and stylish flat in popular Oud-West,"Modern apartment of 50 square meters with stylish second hand and designer furniture, perfect for a couple. My apartment is located in the extremely popular Oud-West district, bordering the Jordaan area. There's food market next door as well as the Foodhallen.<br /><br /><b>The space</b><br />Modern, gezellig appartementje in Oud-West, een populaire buurt naast de Jordaan en vlakbij het Vondelpark en het Leidseplein. <br /><br />Zie voor een uitgebreidere beschrijving de Engelse versie.<br /><br /><b>License number</b><br />03637BFAE25DBC11BCF7","The popular Oud-West district is really central, bordering the Jordaan area. The opening of De Hallen made the area even more popular, and it's really a stone throw away from the apartment. In this architectural highlight you can find art galleries, a cinema, two restaurants and a busy foodcourt with trendy foodstalls. Other things you'll find just around the corner are shops, supermarkets, a food market (just around the corner), cool restaurants and cute (coffee) bars.",https://a0.muscache.com/pictures/c640bbf5-eed1-4248-b84c-d457c7da3e8a.jpg,2302855,https://www.airbnb.com/users/show/2302855,Miriam,2012-05-06,"Amsterdam, Netherlands","Since 2000 I'm living and working in Amsterdam and I will never leave the city again. I work as a freelance copywriter and love nature, music (indie), cats, interior design, reading and writing, cooking and eating. ",within a few hours,100%,78%,f,https://a0.muscache.com/im/users/2302855/profile_pic/1347869981/original.jpg?aki_policy=profile_small,https://a0.muscache.com/im/users/2302855/profile_pic/1347869981/original.jpg?aki_policy=profile_x_medium,Oud-West,1,2,"['email', 'phone']",t,t,"Amsterdam, North Holland, Netherlands",De Baarsjes - Oud-West,,52.36706,4.86465,Entire rental unit,Entire home/apt,2,,1 bath,1.0,1.0,"[""Host greets you"", ""Wifi"", ""Washer"", ""Hair dryer"", ""Luggage dropoff allowed"", ""Hot water"", ""Cooking basics"", ""Kitchen"", ""Stove"", ""Shampoo"", ""Coffee maker"", ""Essentials"", ""Dishes and silverware"", ""Smoke alarm"", ""Iron"", ""Dishwasher"", ""Heating"", ""TV with standard cable"", ""Hangers"", ""Oven"", ""Dryer"", ""Refrigerator"", ""Microwave"", ""Patio or balcony""]",$149.00,3,365,3,3,365,365,3.0,365.0,,t,0,0,0,0,2023-03-10,58,5,1,2012-10-11,2023-03-06,4.83,4.84,4.79,4.88,4.93,4.74,4.7,03637BFAE25DBC11BCF7,f,1,1,0,0,0.46
