290701,https://www.airbnb.com/rooms/290701,20230309202119,2023-03-09,city scrape,"Central, big window, rear room with private bath.","((I have a minimum 3 night stay policy. 1 or 2 night stays is available on request only, send me an email))<br /><br />Big bed quiet room, private bathroom + mini fridge, tea and coffee making facilities. I provide towels and hair-dryer and bed are made.<br /><br /><b>The space</b><br />((I have a minimum 3 night stay policy. 1 or 2 night stays is available on request only, send me email))<br /><br />The room is on the first floor up without lift at the quiet rear side of our four floor apartment in a renovated canal house, which dates from 1930. If this room is not available, we also have a room at the front side of the building with a lovely canal view (check Center,Canal View, Private Bathroom)<br /><br />The room (24 m2)has a private shower and toilet, directly accessable from the room; TV, free WI-FI, quality king-size bed, fridge, coffee and tea facilities. <br /><br /><br />Weekly and monthly rate available. <br /><br />Our home is located in the old town centre of Amsterdam, on","The home is in the heart of the city but is surprisingly quiet <br /><br />Southeast of Centraal Station, Oudezijds lays between the city's red carpet Damrak and the scenic Oude Schans canal. It is capped on its southern end by the River Amstel. The Red Light District only takes up a small portion: within a triangle roughly formed by Centraal Station and the two main squares, Dam and Nieuwmarkt.",https://a0.muscache.com/pictures/pro_photo_tool/Hosting-290701-unapproved/original/7a57c94f-d281-46c1-bbfd-733bfb49ce9a.JPEG,1491565,https://www.airbnb.com/users/show/1491565,David,2011-12-10,"Amsterdam, Netherlands",I lived in Switserland and London(UK) before I moved to Amsterdam. I also have a job in a small boutique hotel in Amsterdam. My partner and I hope to welcome you soon in our house in Amsterdam,within an hour,100%,100%,t,https://a0.muscache.com/im/users/1491565/profile_pic/1323599781/original.jpg?aki_policy=profile_small,https://a0.muscache.com/im/users/1491565/profile_pic/1323599781/original.jpg?aki_policy=profile_x_medium,De Wallen,2,2,"['email', 'phone']",t,t,"Amsterdam, North Holland, Netherlands",Centrum-West,,52.37561,4.9,Private room in home,Private room,2,,1 private bath,1.0,1.0,"[""Host greets you"", ""Wifi"", ""Children\u2019s dinnerware"", ""HDTV with standard cable"", ""Waterfront"", ""Hair dryer"", ""Bed linens"", ""Hot water"", ""Dedicated workspace"", ""Shampoo"", ""Long term stays allowed"", ""Security cameras on property"", ""Lock on bedroom door"", ""Essentials"", ""Smoke alarm"", ""Iron"", ""Extra pillows and blankets"", ""Private entrance"", ""Heating"", ""Fire extinguisher"", ""Carbon monoxide alarm"", ""First aid kit"", ""Hangers"", ""Refrigerator""]",$134.00,3,365,1,3,1125,1125,3.0,1125.0,,t,3,7,13,228,2023-03-09,407,48,2,2012-02-20,2023-02-24,4.86,4.92,4.91,4.93,4.9,4.92,4.76,0363 DF01 FBC0 496B 9730,t,2,0,2,0,3.03
291752,https://www.airbnb.com/rooms/291752,20230309202119,2023-03-10,city scrape,Cozy & large bohemian style room,"Cozy spacious room in a beautiful and spiritually decorated apartment. The room is situated on the 3rd floor of a traditional Amsterdam brick building built in the early 20th century. The apartment is shared with the two hosts and two sweet cats.<br /><br /><b>The space</b><br />The room has a comfortable king size bed. The is a breakfast table with a small fridge and facilities to make coffee and tea. You can browse through the interesting spiritual, photo and art book collection and  there is wifi internet.<br />The exotic bathroom is located on the same floor and is shared with the friendly hosts. Towels, shower gel and shampoo are provided. From the shower you can enjoy the view of the garden and the loud, loitering flocks of ring-necked parakeets.<br /><br /><br />The Area<br /><br />It is a calm yet atmospheric residential area with a diverse population of singles, yuppies, students, artists and families. Right around the corner runs the Amstel river where you can enjoy beautiful","It is a calm yet atmospheric residential area with a diverse population of singles, yuppies, students, artists and families. Right around the corner runs the Amstel river where you can enjoy beautiful views of the Magere Brug ('Skinny bridge') and typical picturesque canal houses and houseboats. <br />A stroll along the green strip that runs beside the Amstel takes you right into the heart of the city. There are many nice bars and restaurants to explore including the popular rugged yet classy industrial club & restaurant Trouw. <br /><br />For food shopping there is a large supermarket just around the corner but for more fun and tasty food shopping close by you can go the the lively area ""De Pijp"" with the famous Albert Cuyp market. It's one of the largest markets in Europe where you can find anything from exotic foods and eateries, traditional Dutch cheese or herring and all kinds of artistic clothing, furniture and crafts. <br /><br />On Waterlooplein you find the Flea market where y",https://a0.muscache.com/pictures/250e82ad-b80b-4a2f-b84e-c7616ef7713e.jpg,1511330,https://www.airbnb.com/users/show/1511330,Ton,2011-12-16,"Amsterdam, Netherlands",I love the city of Amsterdam and like to share its cosmopolitan and peacefull vibe. ,within a few hours,100%,93%,t,https://a0.muscache.com/im/pictures/user/1fea862c-ee8f-4dd3-8455-40f2bbfab4f2.jpg?aki_policy=profile_small,https://a0.muscache.com/im/pictures/user/1fea862c-ee8f-4dd3-8455-40f2bbfab4f2.jpg?aki_policy=profile_x_medium,Oosterparkbuurt,1,1,"['email', 'phone']",t,t,"Amsterdam, North Holland, Netherlands",Oud-Oost,,52.35179,4.91082,Private room in rental unit,Private room,2,,1 bath,1.0,1.0,"[""Wifi"", ""Self check-in"", ""Lockbox"", ""Sound system"", ""HDTV with standard cable"", ""Iron"", ""Washer"", ""Record player"", ""Hair dryer"", ""Dedicated workspace"", ""Refrigerator"", ""Heating"", ""EV charger"", ""Coffee maker"", ""Dishes and silverware"", ""Essentials"", ""Cleaning products"", ""Smoke alarm""]",$126.00,3,1125,3,3,1125,1125,3.0,1125.0,,t,2,7,12,191,2023-03-10,232,23,2,2012-01-02,2023-03-05,4.87,4.93,4.84,4.93,4.92,4.76,4.72,0363 6ACC BA1B 12A9 60C1,f,1,0,1,0,1.7
304082,https://www.airbnb.com/rooms/304082,20230309202119,2023-03-09,city scrape,Quiet studio in the heart of town with Garden!,"<b>The space</b><br />The One Roomed Guesthouse-B&B offer a lovely studio in the very heart of Amsterdam.<br />Located in a old trading building on the famous Amsterdam canals.<br />The Studio Apartment has a private garden, great to use in the summer to have breakfast. You can smoke cigarettes but no weed unfortunately. <br />It has its own private shower and toilet. The studio is near the red light district and in a very urban neighborhood. Shops, bars, restaurants, markets, and museums are all within a walking distance. <br /><br />We are gay-friendly, the best gay bars are just around the corner!<br /><br />Public transport is within a 2 minute walk.<br />And it is a 5 minute walk to Central Station.<br /><br />Check out our GUIDEBOOK, We've put in our favorites! <br /><br />Places that are within a 10 minute walk distance: <br />- waterloo flea market <br />- red light district<br />- amsterdam shopping area <br />- flower market <br />- Leidse square entertainment area <br />- da",,https://a0.muscache.com/pictures/a85c2467-eec4-4c58-9969-79d480309ac5.jpg,276068,https://www.airbnb.com/users/show/276068,Mirre,2010-11-01,"Amsterdam, Netherlands","Welcome to the One Roomed Guesthouse.
We are small, it's all in the name; guesthouse with one studio. We focus on giving our guests an intimate, luxurious experience with local knowledge and must-sees. As a local Amsterdammer and resident of our neighborhood for many years, we know the best tips and tricks to make your stay a pleasant as possible and hopefully with the best local treasures away from the common touristic crowd. Brought up in a family hotel we breathe the dynamics of hosting in our city. We know all the ins and outs about our city, where to go for the best art from the golden age to the newest bars in town. Where to go to for your perfect Amsterdam biking experience and where the secret swimming spots are for the summer. From the best Dutch apple pie to the famous Chinese oysters of Nam Kee.

We hope you will love our city as much as we do.

Enjoy

One Roomed Guesthouse",within a few hours,100%,99%,t,https://a0.muscache.com/im/pictures/user/8e7f6e25-658b-430b-b5fa-d7497f26de1c.jpg?aki_policy=profile_small,https://a0.muscache.com/im/pictures/user/8e7f6e25-658b-430b-b5fa-d7497f26de1c.jpg?aki_policy=profile_x_medium,De Wallen,1,1,"['email', 'phone']",t,t,,Centrum-West,,52.37239,4.89657,Private room in bed and breakfast,Private room,2,,1.5 baths,1.0,2.0,"[""Host greets you"", ""Wifi"", ""Conditioner"", ""Hair dryer"", ""Electric stove"", ""Bed linens"", ""Hot water"", ""Cleaning products"", ""Garden view"", ""Cooking basics"", ""Self check-in"", ""Kitchen"", ""Laundromat nearby"", ""Shampoo"", ""Long term stays allowed"", ""Lockbox"", ""Essentials"", ""Dishes and silverware"", ""Smoke alarm"", ""Body soap"", ""Iron"", ""Extra pillows and blankets"", ""Coffee maker: pour-over coffee"", ""Courtyard view"", ""Private entrance"", ""Shower gel"", ""Heating"", ""Private patio or balcony"", ""Backyard"", ""Fire extinguisher"", ""Ceiling fan"", ""First aid kit"", ""Clothing storage: dresser"", ""Hangers"", ""Crib"", ""Mini fridge"", ""Refrigerator"", ""Pack \u2019n play/Travel crib"", ""Portable fans"", ""Pets allowed"", ""Freezer""]",$146.00,2,1125,2,2,1125,1125,2.0,1125.0,,t,4,6,11,185,2023-03-09,229,72,2,2012-03-22,2023-02-23,4.79,4.79,4.7,4.88,4.85,4.9,4.61,0363 6C40 7413 ADD3 9AF8,f,1,0,1,0,1.72
658063,https://www.airbnb.com/rooms/658063,20230309202119,2023-03-10,city scrape,"Superior, 100m2","Beautiful large apartment in central Amsterdam, High ceilings with lots of light. Very comfortable and large. <br /><br />linen and towels available.<br /><br />There is a nice view at the back of the Garden.<br /><br />The host speaks, English, Spanish, Russian and Dutch<br /><br />PLEASE send me a request before booking the apartment.<br />Thank you.<br /><br /><b>The space</b><br />The room consists of a great living room ,  and a bedroom with 1 double bed and a coach that sleeps 2 people ,  with a view facing the garden. It has its own ensuite bathroom with a bath. PLEASE NOTE THE KITCHEN IS SHARED AND THERE IS NO  COOKING, AND NO OVEN OR STOVE, ONLY MICROWAVE, FRIDGE AND PLATES ect you can make toast, tea, ect. )   The grand chandelier, the exclusive décor, the original wooden floor, the extremely high ceilings and the fact that there is lots of light coming in from both front and back of the house makes this a wonderfully grand living space. It is situated opposite the Vondelpark","Great Central neighbourhood, Supermarkets around the corner, Restaurants and coffee places. Very close to Leidsplein and Vondelpark. <br />Museums walking distance. eg. Rijksmuseum and Van Gogh and Modern art museum. Also near Museumplein and concertgebouw.<br /><br />Busses go from Leidseplein to Schiphol airport",https://a0.muscache.com/pictures/10855272/d26a52f9_original.jpg,3317069,https://www.airbnb.com/users/show/3317069,Marfi,2012-08-20,"Amsterdam, Netherlands","The landlady speaks many different languages and lives herself in the house, which means that you can always have a personal and attentive service. If you have any questions regarding your stay and excursions she would be happy to advise you although you can rest assured of your privacy.",,,100%,f,https://a0.muscache.com/im/pictures/user/baa93981-fca7-463e-bdd0-98530531a548.jpg?aki_policy=profile_small,https://a0.muscache.com/im/pictures/user/baa93981-fca7-463e-bdd0-98530531a548.jpg?aki_policy=profile_x_medium,Oud-West,1,4,"['email', 'phone']",t,t,"Amsterdam, North Holland, Netherlands",De Baarsjes - Oud-West,,52.36188,4.87694,Private room in bed and breakfast,Private room,4,,1 bath,1.0,3.0,"[""Wifi"", ""Room-darkening shades"", ""Hair dryer"", ""Luggage dropoff allowed"", ""Bed linens"", ""Hot water"", ""Cleaning products"", ""Hot water kettle"", ""Toaster"", ""Dining table"", ""Long term stays allowed"", ""Cleaning available during stay"", ""Essentials"", ""Dishes and silverware"", ""Smoke alarm"", ""Bathtub"", ""Wine glasses"", ""Iron"", ""Clothing storage"", ""Heating"", ""Private living room"", ""TV with standard cable"", ""Fire extinguisher"", ""Carbon monoxide alarm"", ""Hangers"", ""Refrigerator"", ""Ethernet connection""]",$125.00,3,1125,3,3,1125,1125,3.0,1125.0,,t,5,8,12,12,2023-03-10,117,6,0,2013-01-03,2022-05-27,4.36,4.28,4.22,4.66,4.65,4.75,4.23,ABCD 1234 AB12 89EF A0F9,f,1,0,1,0,0.94
304143,https://www.airbnb.com/rooms/304143,20230309202119,2023-03-10,previous scrape,Unique Beautiful Houseboat (ship) in Center,"The best way to experience Amsterdam-City. Living on a Houseboat with a garden in a quiet and green neighborhood ('de Plantage'). Please compare this location with other offers on AirBNB and make sure you don't end up in some suburb with less privacy!<br />Incredible view from the boat. Public transport with direct connection to Central Station (15 mins) and all major museums (10 mins) at 100 meters. Restaurants, bars, daily shopping, and a great market nearby.<br /><br /><b>The space</b><br />Situated on the outer canal in the center of Amsterdam. Entrance through our private garden. Splendid view on Tropical Museum (regular nice exhibitions. Good for a rainy day. Only two mins walk) and Oosterpark. Central Heating and wood burning stove. Double bed (140*200). Shower. Small toilet (see the end). Television. WiFi. <br />Very good high frequent public transport within 100 meters. Tram line 14 brings you in 10 minutes in the city center. Tram lines 7 and 19  bring you in 10 minutes to al",The Plantage neighborhood is part of the city center but quite relaxed and with a lot of green and the Zoo. And the busy part of the city center is at only 10 minutes by public transport.,https://a0.muscache.com/pictures/3201940/ec9c556d_original.jpg,1565319,https://www.airbnb.com/users/show/1565319,Dick,2012-01-04,"Amsterdam, Netherlands","I am a scientist working in the field of intuition research at the University of Amsterdam and Groningen. 
During the summer we travel on this boat over the rivers and coastal seas of Europe. 
I enjoy creating an atmosphere of hospitality, to make you feel welcome without disturbing privacy. When I am traveling my daughter takes care of you.


",,,100%,f,https://a0.muscache.com/im/users/1565319/profile_pic/1325684461/original.jpg?aki_policy=profile_small,https://a0.muscache.com/im/users/1565319/profile_pic/1325684461/original.jpg?aki_policy=profile_x_medium,Weesperbuurt en Plantage,1,2,"['email', 'phone']",t,t,"Amsterdam, North Holland, Netherlands",Oud-Oost,,52.3623,4.92028,Boat,Entire home/apt,2,,1 bath,1.0,1.0,"[""Host greets you"", ""Wifi"", ""Indoor fireplace"", ""Hair dryer"", ""Hot water"", ""Garden view"", ""Cooking basics"", ""Single level home"", ""Kitchen"", ""Stove"", ""Shampoo"", ""Coffee maker"", ""Essentials"", ""Dishes and silverware"", ""Paid parking on premises"", ""Extra pillows and blankets"", ""Private entrance"", ""Heating"", ""Shared backyard \u2013 Fully fenced"", ""Fire extinguisher"", ""BBQ grill"", ""First aid kit"", ""Canal view"", ""Hangers"", ""Oven"", ""TV with Chromecast"", ""Smoking allowed"", ""Refrigerator"", ""Microwave""]",$88.00,28,1125,28,28,1125,1125,28.0,1125.0,,t,0,0,0,0,2023-03-10,52,0,0,2012-02-17,2020-03-07,4.55,4.85,4.06,4.91,4.86,4.85,4.44,0363AF9644094CEBCE6B,f,1,1,0,0,0.39
660856,https://www.airbnb.com/rooms/660856,20230309202119,2023-03-10,previous scrape,Large 4 floor art-filled family-friendly townhouse,"Our spacious and light home is an oasis in busy Amsterdam. Plenty of space (225m2) over four floors to relax, to cook, have meals, and plan the next day in town. Shops, markets, restaurants and bars all at walking distance (and all open again!) in this cosy corner of the city. Excellent house for families or colleagues (we don't rent to groups of friends - sorry). Obviously, the house will be cleaned thoroughly before you move in.<br /><br /><b>The space</b><br />This 100 year old townhouse with garden is in the east of Amsterdam and has 225 m2. There are 2 double beds and 5 single beds, and three bathrooms.<br /><br />We have kept the characteristics of this beautiful old house intact, but renovated it in such a way that it is spacious, modern and practical. Fifteen minutes from the centre by bike or tram. Tram 19 stops at a 4 minute walk from our house. <br /><br />At the ground floor, you'll find a well equipped kitchen with a dishwasher, oven, espresso machine and boiling water sys",,https://a0.muscache.com/pictures/8d8fdcae-fa9c-4883-ac40-7d583bca904d.jpg,3336575,https://www.airbnb.com/users/show/3336575,Maaike,2012-08-22,"Amsterdam, Netherlands","Ik ben manager bij een NGO. Onze kinderen zijn 24, 22 en 19 jaar oud. We hebben vaak ons huis geruild, dus zijn bekend met het concept.",,,67%,f,https://a0.muscache.com/im/pictures/user/bc4f3f72-60de-4ec9-8a2f-12f155b22f90.jpg?aki_policy=profile_small,https://a0.muscache.com/im/pictures/user/bc4f3f72-60de-4ec9-8a2f-12f155b22f90.jpg?aki_policy=profile_x_medium,Watergraafsmeer,1,1,"['email', 'phone', 'work_email']",t,t,,Watergraafsmeer,,52.3551,4.93262,Entire townhouse,Entire home/apt,5,,3 baths,4.0,6.0,"[""Wifi"", ""Children\u2019s dinnerware"", ""Room-darkening shades"", ""Washer"", ""Indoor fireplace"", ""Hair dryer"", ""Luggage dropoff allowed"", ""Outdoor furniture"", ""Private backyard \u2013 Fully fenced"", ""Hot water"", ""Cooking basics"", ""Kitchen"", ""Dedicated workspace"", ""Game console"", ""Children\u2019s books and toys"", ""Stove"", ""Shampoo"", ""Babysitter recommendations"", ""Coffee maker"", ""Essentials"", ""Dishes and silverware"", ""Smoke alarm"", ""Paid parking off premises"", ""Bathtub"", ""Gym"", ""Changing table"", ""Heating"", ""Dishwasher"", ""TV with standard cable"", ""Fire extinguisher"", ""First aid kit"", ""Oven"", ""Dryer"", ""Refrigerator"", ""Microwave"", ""Patio or balcony""]",$275.00,28,33,28,28,33,33,28.0,33.0,,t,0,0,0,3,2023-03-10,40,2,0,2012-12-30,2022-07-24,4.82,4.72,4.26,4.9,4.92,4.82,4.79,0363 528E 3889 FA20 43A1,f,1,1,0,0,0.32
664697,https://www.airbnb.com/rooms/664697,20230309202119,2023-03-10,city scrape,Design Waterfront flat near station,"The flat is located in a new area across from the central station, on the IJ, the main water in Amsterdam. It is a modern building, designed by architects, with floor heating and double glazing. The interior is a mixture between modern and antique.<br /><br /><b>The space</b><br />My flat is very close to the central station and centre of Amsterdam, on the waterfront of the main water 'Het IJ'. From the balcony you have a view of the water with big boats sailing through. It is a new flat in a area with a few new luxury apartment blocks and you reach there by a short ferry-ride (2 minutes from the central station, the ferry is free and runs al day and night every few minutes). This is a trendy upcoming neighborhood with the new film institute (open air cinema and 4 indoor screens with an excellent choice of classic and new film), the new Pop-temple Tolhuis, with a waterfront beach-like terrace. There is a museum, trendy restaurants and other initiatives. It is the area where the hipster","The neighbourhood is trendy and upcoming. There are many new buildings, since it is an area that has been developed the last 10 years. Right behind the neighborhood is older and some buildings are monumental with new restaurants due to the new developments. The neighborhood is across from the central station, opposite the center. Hence, it has a large waterfront with big boats, sailing ships and cruise ships as well as smaller boats. <br />It is very close to the center, but a bit quieter and more spacious, because it is newer. As an area across the water from the centere, there is music, cafes, restaurants, parks, festivals, etc., etc.",https://a0.muscache.com/pictures/9188502/cb238cc7_original.jpg,1406783,https://www.airbnb.com/users/show/1406783,Alicia,2011-11-14,"Amsterdam, Netherlands","Hi my name is Alicia,  I am a runner, yoga-fan and architect in daily life and I love traveling, seeing new places and meeting new people. ",within a few hours,90%,0%,f,https://a0.muscache.com/im/pictures/user/a60b5bfa-560b-4ef9-a1a2-6de51004ed6e.jpg?aki_policy=profile_small,https://a0.muscache.com/im/pictures/user/a60b5bfa-560b-4ef9-a1a2-6de51004ed6e.jpg?aki_policy=profile_x_medium,,2,3,"['email', 'phone', 'work_email']",t,t,"Amsterdam, North Holland, Netherlands",Oud-Noord,,52.38537,4.90241,Entire loft,Entire home/apt,2,,1.5 baths,1.0,1.0,"[""Hot tub"", ""Host greets you"", ""Wifi"", ""Washer"", ""Free street parking"", ""Hair dryer"", ""Hot water"", ""Kitchen"", ""Shampoo"", ""Long term stays allowed"", ""Security cameras on property"", ""Essentials"", ""Smoke alarm"", ""Elevator"", ""Iron"", ""Heating"", ""TV with standard cable"", ""Fire extinguisher"", ""Carbon monoxide alarm"", ""Hangers"", ""Paid parking on premises""]",$87.00,30,180,30,30,180,180,30.0,180.0,,t,0,5,5,244,2023-03-10,63,0,0,2012-09-24,2018-06-30,4.33,4.08,4.23,4.57,4.6,4.61,4.25,Exempt,f,2,2,0,0,0.49
307497,https://www.airbnb.com/rooms/307497,20230309202119,2023-03-10,city scrape,Historical sailing ship Amsterdam,"Unique once in a lifetime experience!<br /><br />Welcome on board of our historical sailing ship ""Chateauroux"", in summer docked  at Amsterdam, Enkhuizen or Monnickendam. Live freely and experience the life on water like many of our Amsterdam citizens. Our skipper will be happily telling you about the ship, sailing and the city.<br /><br /><b>The space</b><br />The Chateauroux is a large sailing ship built in 1908. Since its renovation in 1986, this classic Dutch ship now offers 26 beds. Great for larger groups for a unique experience<br /><br />In summer (May-October), the ship may be in Amsterdam (Pontsteiger), Enkhuizen or Monnickendam. Ask where the ship will be during your stay. Amsterdam's best experiences and must-sees such as the historic canals, museums, shops, bars, restaurants, concert halls & theaters are located in the area around the ship. Besides the vibrancy of the city, you can withdraw to the quiet, private and safe location of the ship. <br /><br />There are 10 sleep","Amsterdam (Pontsteiger) - From the northern Pontsteiger, you are in the city in no time. The nearby Westerpark blends green spaces, a lively creative and nightlife scene, and iconic architecture. Along with its regular exhibitions, markets and festivals, the converted Westergasfabriek gasworks contains indie shops, eclectic eateries, an art-house cinema, a brewery and a dance club. Nearby, the Museum Het Schip is the focus of a residential area of red-brick Amsterdam School buildings.",https://a0.muscache.com/pictures/miso/Hosting-307497/original/22228234-e9e2-49c6-b346-ff5218f5901f.jpeg,176944339,https://www.airbnb.com/users/show/176944339,Dion,2018-03-06,Netherlands,,,,,f,https://a0.muscache.com/im/pictures/user/49356c22-9b66-4846-95d0-8512087ebc8e.jpg?aki_policy=profile_small,https://a0.muscache.com/im/pictures/user/49356c22-9b66-4846-95d0-8512087ebc8e.jpg?aki_policy=profile_x_medium,,2,2,"['email', 'phone']",t,t,"Amsterdam, Noord-Holland, Netherlands",Westerpark,,52.39185,4.8869,Boat,Entire home/apt,16,,2.5 baths,10.0,26.0,"[""Building staff"", ""Wifi"", ""Waterfront"", ""Luggage dropoff allowed"", ""Pocket wifi"", ""Bed linens"", ""Hot water"", ""Cleaning products"", ""Cooking basics"", ""Self check-in"", ""Kitchen"", ""Stove"", ""Coffee maker"", ""Essentials"", ""Dishes and silverware"", ""Smoke alarm"", ""Private entrance"", ""Heating"", ""Boat slip"", ""Fire extinguisher"", ""First aid kit"", ""Canal view"", ""Hangers"", ""Oven"", ""Refrigerator"", ""Pets allowed"", ""Patio or balcony""]","$1,063.00",2,30,1,2,30,30,2.0,30.0,,t,6,16,19,149,2023-03-10,105,5,0,2012-09-10,2022-11-01,4.87,4.81,4.71,4.85,4.88,4.58,4.48,Exempt,f,2,2,0,0,0.82
