255809,https://www.airbnb.com/rooms/255809,20230309202119,2023-03-10,city scrape,stylish apartment free car parking and 2 bikes,"The apartment is part of ground floor of our house.<br /><br /><b>The space</b><br />This cosy and modern apartment is for four persons. There are 2 comfortable queen size beds. They can be separated on request. There is one small bathroom situated in one of the bedrooms and a little kitchenette, in the other bedroom, with coffee -and tea facilities.<br />'the house of finer'  is situated across from the Amsterdam Convention Centre RAI and the gorgeous Beatrixpark. The B&B is appropriate for visitors that go to conventions and fairs in the RAI or for guests who come by car to Amsterdam but decide to go into town by bike or tram.  This holiday B&B rental is only two minutes walk from the metro and restaurants and 2 minutes drive from the highway A10 and fifteen minutes from Amsterdam Schiphol Airport. Included in the price is free parking of one car.<br /><br /><b>Guest access</b><br />There is a small terrace at both rooms which can be used, but no smoking is allowed in the garden.<br ","The house of finer is situated in Amsterdam Zuid, next to the convention centre, RAI, the Beatrixpark and at the waterside the Boerenwetering. You can ride your own bikes to the city centre, museums and the nice restaurants or drive down the Amstel river and enjoy the green outskirts of Amsterdam. There is an electric boats rental next to house to make a magical boatride in the centre. Also you can run or walk in the lovely Beatrix park across the street. <br />There are lots of restaurants and breakfast places around the corner.",https://a0.muscache.com/pictures/2dec027c-e715-4535-82dd-9b918d33bc5a.jpg,1344947,https://www.airbnb.com/users/show/1344947,Flo&André,2011-10-28,"Amsterdam, Netherlands","We have a modern family house and like to share some rooms with guests. A good B&B host is somebody who shows you the way and walks up with you. 

Besides the house in Amsterdam, we have a great apartment on the slopes of the French alps, in Avoriaz.",within an hour,100%,96%,f,https://a0.muscache.com/im/pictures/user/dc4fc1da-b2f2-47f9-8520-e53b169323a9.jpg?aki_policy=profile_small,https://a0.muscache.com/im/pictures/user/dc4fc1da-b2f2-47f9-8520-e53b169323a9.jpg?aki_policy=profile_x_medium,Oud-Zuid,2,3,"['email', 'phone']",t,t,"Amsterdam, NH, Netherlands",De Pijp - Rivierenbuurt,,52.34416,4.88709,Private room in loft,Private room,4,,1 private bath,2.0,2.0,"[""Drying rack for clothing"", ""Host greets you"", ""Wifi"", ""Waterfront"", ""Hair dryer"", ""Luggage dropoff allowed"", ""Pocket wifi"", ""Outdoor furniture"", ""Bed linens"", ""Hot water"", ""Cleaning products"", ""Garden view"", ""Hot water kettle"", ""Laundromat nearby"", ""Toaster"", ""Dining table"", ""Dedicated workspace"", ""Shampoo"", ""Free parking on premises"", ""Lock on bedroom door"", ""Coffee maker"", ""Essentials"", ""Dishes and silverware"", ""Smoke alarm"", ""Outdoor dining area"", ""Bathtub"", ""Wine glasses"", ""Paid parking off premises"", ""Body soap"", ""Iron"", ""Extra pillows and blankets"", ""Private entrance"", ""Shower gel"", ""Heating"", ""Books and reading material"", ""Shared backyard \u2013 Fully fenced"", ""Coffee"", ""Lake access"", ""Fire extinguisher"", ""Shared patio or balcony"", ""Clothing storage: walk-in closet"", ""First aid kit"", ""Hangers"", ""Mini fridge"", ""Refrigerator"", ""Portable fans"", ""Microwave"", ""Bikes""]",$168.00,2,20,2,2,20,20,2.0,20.0,,t,5,6,6,150,2023-03-10,155,46,4,2012-04-28,2023-03-05,4.86,4.9,4.94,4.9,4.88,4.78,4.68,0363 A842 020A 9193 B416,f,1,0,1,0,1.17
608432,https://www.airbnb.com/rooms/608432,20230309202119,2023-03-10,city scrape,Sleep at Amy's B'n'B Front Room,"The rooms are freshly painted, with new laminate flooring. Each room has coffee and tea service, along with a microwave and refrigerator, and cups, plates and silverware.<br /><br />We also have a second room in this location that is a bit bigger and nicer, and quieter:<br /><br />Sleep at Amy's B'n'B Garden Room:<br /><br />https://www.airbnb.com/rooms/627188<br /><br /><b>The space</b><br />We call our place a Bed and Beverage, as premium coffee and tea is available in your room, as well as a welcome drink in the mini fridge. We choose not to serve breakfast, as there are so many wonderful shops, cafes, restaurants and grocery stores literally steps from our front door.<br />Our BnB is located in the heart of Amsterdam on the historic Haarlemmerdijk, only a short walk from the Centraal Station.<br />The Front room has a view of the Haarlemmerdijk, with its funky shops, cafes and restaurants. (This listing is for the Frontroom with one double bed).<br />The Garden Room is the larger o","The Haarlemmerbuurt is a wonderful and historic neighborhood.<br />Originally, this was the main road to Haarlem- hence the name.<br />Starting at the Singel Canal, where the street is called Haarlemmerstraat, past the Eenhoornsluis (The Unicorn Lock!), it changes name to Haarlemmerdijk and continues all the way to the Haarlemmerplein<br />You will find much to see and do here. If you love shopping, eating, drinking or just sightseeing, this is the place to stay.",https://a0.muscache.com/pictures/miso/Hosting-608432/original/41435db0-6107-4869-b5cc-b271e2c3fbe3.jpeg,3015785,https://www.airbnb.com/users/show/3015785,Erik And Mary Jo,2012-07-22,"Amsterdam, Netherlands",We are an American couple running a Bed and Breakfast here in Amsterdam for 10 years.,within an hour,100%,100%,t,https://a0.muscache.com/im/pictures/user/f98f78e6-133a-4abe-a8fd-62786674904d.jpg?aki_policy=profile_small,https://a0.muscache.com/im/pictures/user/f98f78e6-133a-4abe-a8fd-62786674904d.jpg?aki_policy=profile_x_medium,Westelijke Eilanden,2,2,"['email', 'phone']",t,t,"Amsterdam, Haarlemmerbuurt, Netherlands",Centrum-West,,52.381996,4.888583,Private room in bed and breakfast,Private room,2,,1 shared bath,,1.0,"[""Host greets you"", ""Room-darkening shades"", ""Hair dryer"", ""Bed linens"", ""Hot water"", ""Laundromat nearby"", ""Shampoo"", ""Security cameras on property"", ""Lock on bedroom door"", ""Coffee maker"", ""Essentials"", ""Dishes and silverware"", ""Smoke alarm"", ""Body soap"", ""Wifi \u2013 21 Mbps"", ""Extra pillows and blankets"", ""Heating"", ""Coffee"", ""Carbon monoxide alarm"", ""Hangers"", ""Mini fridge"", ""Portable fans"", ""Microwave""]",$95.00,1,10,1,1,1125,1125,1.0,1125.0,,t,1,5,20,20,2023-03-10,774,97,4,2012-08-15,2023-03-06,4.75,4.84,4.77,4.94,4.92,4.9,4.68,0363 AACD 8155 9F76 50DA,f,2,0,2,0,6.02
613088,https://www.airbnb.com/rooms/613088,20230309202119,2023-03-09,city scrape,Your own cottage in the countryside,"Zunderdorp is a little 17th century village near Amsterdam. In your B&B cottage you have your private bathroom and a breakfast room. <br />Visit the town centre (15 minutes by bus) or the countryside with several villages like Broek in Waterland, Volendam<br /><br /><b>The space</b><br />Zunderdorp is a little 17th century village near Amsterdam. In your B&B cottage you have your private bathroom and a breakfast room. <br />Visit the town centre (15 minutes by bus) or the countryside with several villages like Broek in Waterland, Volendam and Zaanse Schans. The cows are your neighbours and you will find a golf court next door. Free parking.<br /><br />You have a room with a unlimited view on the countryside. Free bicycles and cycle route maps available. Visit the area where Rembrandt made his drawings.<br /><br />You can also use the diningroom-livingroom which you share with other guests. Around the house is a big terrace.<br /><br />Amsterdam center is easy to reach by public transpo",,https://a0.muscache.com/pictures/7764816/a5c4c90b_original.jpg,3040748,https://www.airbnb.com/users/show/3040748,Henk,2012-07-24,"Amsterdam, Netherlands","Living in the countryside, just near Amsterdam is great fun. We live between the meadows in a very quet area and at the same time a great city is at armlength.  
My profession is IT projectmanager, and I am a local historian and a musician, playing the trombone in the local orchestra. Together with my wife Annemieke we run the B&B.",within a few hours,100%,75%,f,https://a0.muscache.com/im/users/3040748/profile_pic/1352910136/original.jpg?aki_policy=profile_small,https://a0.muscache.com/im/users/3040748/profile_pic/1352910136/original.jpg?aki_policy=profile_x_medium,,13,15,"['email', 'phone']",t,t,,Noord-Oost,,52.41016,4.96369,Private room in farm stay,Private room,2,,1 private bath,1.0,1.0,"[""Host greets you"", ""Wifi"", ""Long term stays allowed"", ""Hangers"", ""Kitchen"", ""Washer"", ""Hair dryer"", ""Hot water"", ""Private entrance"", ""Shampoo"", ""Free parking on premises"", ""Luggage dropoff allowed"", ""Heating"", ""Breakfast"", ""Pets allowed"", ""Essentials"", ""TV with standard cable"", ""Smoke alarm""]",$87.00,2,1125,2,2,1125,1125,2.0,1125.0,,t,1,1,1,68,2023-03-09,411,32,0,2012-08-25,2023-01-25,4.86,4.81,4.81,4.91,4.9,4.78,4.79,0363 C2FC D0FB 68D9 2F58,f,10,0,10,0,3.2
613110,https://www.airbnb.com/rooms/613110,20230309202119,2023-03-09,city scrape,"All u need, nice place in amsterdam","Neat private room and luxury bathroom (shared with other guests)<br />The room has four beds with a romantic few over the water. The lovely bathroom is new, big and clean and even has a bath.<br />Architectural area, 12 min. to central station by tram<br /><br /><b>The space</b><br />Neat room on toplocation in Amsterdam, with a private bathroom up to 4 people.<br />On toplocation with architectural houses.<br />Just three minutes walk to the tramstop. By tram within 12 minutes in the center (central station Amsterdam) or take one of the guestbikes for a ride into the center (10 euro a day). Public transportation runs 24 hours from the center to the house, including the nightbus (during the day the tram runs every 6 minutes). <br />Breakfast, high speed wireless internet, clean sheets and towels are all included. Cars can be parked after prior permission on our property for 10 euro per day per car. Late check-in is no problem, early check-in can be arranged most of the time. Before 11a","Architectural area, clean and quiet, but still close to the center, just take the tram (nr 26)or the nightbus (nr 359) at the end of the street, 12 minutes to central station.<br />Exclusive designshop across the street with a lunchroom and restaurant and a unique view on the waterside. Then there is a second (low profile) restaurant in front of the bridge around the corner. <br />A shopping center with 2 supermarkets, lunchrooms, bakery, restaurants, etc. just one tramstop away or a short walk over one of the bridges. <br />Young and old love our area since it is spacey, clean, nice waterviews, easy to find and one of the safest places in Amsterdam.",https://a0.muscache.com/pictures/691265ad-c3ea-4fdf-806c-e6300f8cae22.jpg,3040855,https://www.airbnb.com/users/show/3040855,Michael,2012-07-24,"Amsterdam, Netherlands","Easygoing, worldcitizen, love the air and the big multicultural cities.
Like to meet people from different cultures, during my business travels and always look forward to meet new people in my hometown Amsterdam.
As a host, guests can count on me and can expect a nice stay in a clean room.",within an hour,100%,100%,f,https://a0.muscache.com/im/users/3040855/profile_pic/1421871468/original.jpg?aki_policy=profile_small,https://a0.muscache.com/im/users/3040855/profile_pic/1421871468/original.jpg?aki_policy=profile_x_medium,Oost,1,6,"['email', 'phone']",t,t,"Amsterdam, North Holland, Netherlands",IJburg - Zeeburgereiland,,52.36368,4.9794,Private room in townhouse,Private room,4,,1.5 baths,1.0,3.0,"[""Board games"", ""Drying rack for clothing"", ""Wifi"", ""Children\u2019s dinnerware"", ""Waterfront"", ""Conditioner"", ""Hair dryer"", ""Paid valet parking on premises \u2013 1 space"", ""Luggage dropoff allowed"", ""Bed linens"", ""Hot water"", ""Cleaning products"", ""Hot water kettle"", ""Rice maker"", ""Public or shared beach access"", ""Self check-in"", ""Laundromat nearby"", ""Toaster"", ""Central heating"", ""Dining table"", ""Dedicated workspace"", ""Children\u2019s books and toys"", ""Shampoo"", ""Babysitter recommendations"", ""Free parking on premises"", ""Long term stays allowed"", ""Cleaning available during stay"", ""Paid washer \u2013 In building"", ""Lock on bedroom door"", ""Coffee maker"", ""Lockbox"", ""Essentials"", ""Dishes and silverware"", ""Smoke alarm"", ""Bathtub"", ""Wine glasses"", ""Body soap"", ""Iron"", ""Free dryer \u2013 In building"", ""Extra pillows and blankets"", ""Freezer"", ""Lake view"", ""Clothing storage"", ""Shower gel"", ""Books and reading material"", ""Dishwasher"", ""Private entrance"", ""Coffee"", ""Boat slip"", ""Lake access"", ""Fire extinguisher"", ""Carbon monoxide alarm"", ""First aid kit"", ""Hangers"", ""Mini fridge"", ""Oven"", ""Refrigerator"", ""Portable fans"", ""Paid parking lot off premises"", ""Microwave"", ""Bikes"", ""Piano"", ""Ethernet connection""]",$86.00,1,1125,1,1,1125,1125,1.0,1125.0,,t,12,18,26,221,2023-03-09,292,13,0,2012-08-26,2022-10-30,4.27,4.28,4.45,4.63,4.61,4.34,4.19,0363680E27996E5AC8C6,t,1,0,1,0,2.28
623123,https://www.airbnb.com/rooms/623123,20230309202119,2023-03-10,city scrape,Beautiful and spacious apartment with big rooftop,"A beautiful light and spacious (200 m2) apartment located in the popular old west area. On the very large rooftopterrace with a 360 view, you can see all over the city. The apartment is very near the Vondelpark and close to various nice restaurants and shops. It has 2 bedrooms for adults and 1 kidsroom, so it’s ideal for two couples or a family.<br /><br /><b>The space</b><br />Beautiful apartment in the Old West neighbourhood of Amsterdam. (Helmerbuurt) Located close to the Vondelpark and basically near all other important sights in Amsterdam. If you want to be a real Amsterdam local, you can rent a bicycle just around the corner. The tram stops just 50 meters away and will bring you to the old city centre within 5 minutes. <br /> <br />In this cosy part of Amsterdam there are a lot of nice restaurants and shops. And for your convenience an Albert Heijn supermarket is right across the street.  <br /> <br />The two floor apartment is beautifully decorated and is very light and spacious",The apartment is near a lot of shops and restaurants. The Vondelpark is a 2 minute walk. In the park are several playgrounds and café’s.,https://a0.muscache.com/pictures/719aab9e-e6f4-4805-8655-b59afae2e96b.jpg,2695123,https://www.airbnb.com/users/show/2695123,Janne,2012-06-20,"Amsterdam, Netherlands","I love Amsterdam, New York, sports, healthy food and my husband :) We're both working in Amsterdam and love to travel. ",within an hour,100%,88%,f,https://a0.muscache.com/im/users/2695123/profile_pic/1343570029/original.jpg?aki_policy=profile_small,https://a0.muscache.com/im/users/2695123/profile_pic/1343570029/original.jpg?aki_policy=profile_x_medium,Oud-West,1,1,"['email', 'phone']",t,t,"Amsterdam, North Holland, Netherlands",De Baarsjes - Oud-West,,52.36247,4.86534,Entire rental unit,Entire home/apt,4,,3 baths,3.0,2.0,"[""Host greets you"", ""Wifi"", ""Children\u2019s dinnerware"", ""Room-darkening shades"", ""Hair dryer"", ""Pocket wifi"", ""Free washer \u2013 In unit"", ""Outdoor furniture"", ""Bed linens"", ""Hot water"", ""Free dryer \u2013 In unit"", ""Cooking basics"", ""Smeg gas stove"", ""City skyline view"", ""High chair"", ""Kitchen"", ""Park view"", ""Baby safety gates"", ""Baby bath"", ""HDTV with Netflix, premium cable, standard cable"", ""Children\u2019s books and toys"", ""Dedicated workspace"", ""Shampoo"", ""Baby monitor"", ""Coffee maker"", ""Central air conditioning"", ""Essentials"", ""Dishes and silverware"", ""Smoke alarm"", ""Outdoor dining area"", ""Bathtub"", ""Paid parking off premises"", ""Changing table"", ""Iron"", ""Heating"", ""Dishwasher"", ""Private patio or balcony"", ""Fire extinguisher"", ""BBQ grill"", ""Carbon monoxide alarm"", ""Crib"", ""Hangers"", ""Oven"", ""Refrigerator"", ""Pack \u2019n play/Travel crib"", ""Microwave""]",$450.00,5,21,5,5,21,21,5.0,21.0,,t,0,3,3,26,2023-03-10,25,5,0,2012-09-23,2022-08-28,5.0,4.96,4.96,5.0,5.0,4.96,4.88,0363 C125 F449 C407 9F89,f,1,1,0,0,0.2
262394,https://www.airbnb.com/rooms/262394,20230309202119,2023-03-10,previous scrape,Charming Studio with Roof Terrace,"Charming Studio  with beautiful Sunny Rooftop Terrace centrally located (5 min Vondelpark / 10 min Rijksmuseum / Leidseplein)! Your realy have the feeling living in a residential save area with nice trendy local cafes and restaurants on the corner.<br /><br /><b>The space</b><br />Charming Studio with Rooftop Terrace centrally located. A 4 minutes walk to the Vondelpark. Nearby are several trendy cafes and  restaurants where you may go for drinks, lunch or dinner. A 10 minutes walk to the heart of the city centre. Tram and bus lines are nearby and so are the Van Gogh Museum, Rijks Museum, the Concert Gebouw and the Entertainment Area (Leidse Plein). You can rent a bike and experience Amsterdam as a native.   <br /><br />The Studio is on the third and fourth floor. I live downstairs. There is a flat screen TV and wireless internet. The terrace is large and comfortable. And when the weather is nice, you can dine outside. In the summertime you will have sun on the terrace from 10.30 am ti",Close to the old Center of Amsterdam<br />Close to Vondelpark<br />Tranquil residential Neighbourhood<br />Nice Trendy restaurants/cafés on the corner<br />Nice Sunny RoofTerrace to relax / enjoy,https://a0.muscache.com/pictures/7905705/5b98551c_original.jpg,1376607,https://www.airbnb.com/users/show/1376607,Martin,2011-11-06,"Amsterdam, Netherlands","Hallo, My name is Martin. I like to travel with friends. While traveling I prefer using AIRBNB and other sources because I am interested in how the local people live and like being part of that. I also would like to give you experience. I am looking forward to welcoming you to Amsterdam.

I live downstairs and am available  for questions, tips etc.

If  you want to have more information, please let me know.
",,,,f,https://a0.muscache.com/im/users/1376607/profile_pic/1320686458/original.jpg?aki_policy=profile_small,https://a0.muscache.com/im/users/1376607/profile_pic/1320686458/original.jpg?aki_policy=profile_x_medium,Hoofddorppleinbuurt,1,3,"['email', 'phone']",t,t,"Amsterdam, North Holland, Netherlands",Zuid,,52.35695,4.85234,Private room in rental unit,Private room,2,,1 private bath,1.0,1.0,"[""Carbon monoxide alarm"", ""Wifi"", ""Hangers"", ""Kitchen"", ""Patio or balcony"", ""Paid parking off premises"", ""Iron"", ""Hair dryer"", ""Hot water"", ""Shampoo"", ""Heating"", ""Fire extinguisher"", ""Coffee maker"", ""Dishes and silverware"", ""Essentials"", ""TV with standard cable"", ""Smoke alarm""]",$88.00,3,30,3,3,1125,1125,3.0,1125.0,,t,0,0,0,0,2023-03-10,113,0,0,2012-04-11,2019-10-07,4.83,4.83,4.86,4.98,4.95,4.69,4.66,0363 B86D 98DE 3A24 8790,f,1,0,1,0,0.85
274688,https://www.airbnb.com/rooms/274688,20230309202119,2023-03-10,previous scrape,Cozy sleeping in popular Amsterdam West,"My trendy and comfortable apartment on the westside of Amsterdam will give you a perfect stay in a great neighborhood. Within 5 minutes you can have a picknick in the famous Erasmusparc, have a nice drink on a terrace or eat at a cozy restaurant!<br /><br /><b>The space</b><br />This apartment has one bedroom,a bathroom, a huge living room, a kitchen and two balconies and is about 60m2. There is free internet.<br /><br />The apartment is 3 minutes from the Erasmuspark, nearby the famous West area Baarsjes, Westerpark and cosy Jordaan district. From the apartment to the city centre (Dam-square) it's only ten minutes with the tram or bus. Public transport is on the corner and bike renting is also on the corner.<br /><br />Around Westerpark you find some interesting shops, restaurant and long canals where is great to visit during the summer and some lovely pubs. The Jordaan is ofcourse the heart of the city and is an attraction you must not miss.<br /><br />The neighbourhood is called Bos","This neighborhood is fantastic! The Baarsjes is on the corner with really nice restaurants, shops and cafés. Also the Westerpark and the Erasmuspark is the best in spring and summertime. <br />If you come i will look up all the nice things to do during the days you will stay in Amsterdam. So you won't miss a thing :-)",https://a0.muscache.com/pictures/miso/Hosting-274688/original/75375748-a9fb-4360-85ae-0524e65fc6cd.jpeg,1435990,https://www.airbnb.com/users/show/1435990,Marij,2011-11-23,"Amsterdam, Netherlands","Hello!

I am Marij de Vries, 39 years young and living in Amsterdam. In 2010 i bought my own appartment in the west of Amsterdam. I work as an Eventmanager at a marketing and salesoffice in Amsterdam. In my sparetime i love doing different kinds of sports, hangout with my friends and playing the guitar. During summer you will find me very often in the parc and festivals.
I also love to travel. I have been to Thailand, Indonesia, Cambodia, Malaysia, Vietnam, China, Panama, Laos, Nepal, India en lot's of places in Europe. 

For you as a guest i don't have to tell you about how great it will be for you to stay in Amsterdam! From my place to the centre of Amsterdam it's 10 minutes with the tram or, if you dare, on the biclycle :-)





",within a day,100%,20%,f,https://a0.muscache.com/im/pictures/user/42b27351-8fa0-4561-b2c7-07dd135871db.jpg?aki_policy=profile_small,https://a0.muscache.com/im/pictures/user/42b27351-8fa0-4561-b2c7-07dd135871db.jpg?aki_policy=profile_x_medium,Bos en Lommer,1,1,"['email', 'phone']",t,t,"Amsterdam, North Holland, Netherlands",Bos en Lommer,,52.37977,4.85574,Entire condo,Entire home/apt,2,,1 bath,1.0,1.0,"[""Bluetooth sound system"", ""Host greets you"", ""Wifi"", ""Washer"", ""Blender"", ""Hair dryer"", ""Bed linens"", ""Hot water"", ""Cleaning products"", ""Cooking basics"", ""Kitchen"", ""Laundromat nearby"", ""Toaster"", ""Dining table"", ""Shampoo"", ""Essentials"", ""Dishes and silverware"", ""Smoke alarm"", ""Wine glasses"", ""Body soap"", ""Iron"", ""Extra pillows and blankets"", ""Private entrance"", ""Heating"", ""Dishwasher"", ""Private patio or balcony"", ""Gas stove"", ""Fire extinguisher"", ""Carbon monoxide alarm"", ""Paid street parking off premises"", ""Hangers"", ""Oven"", ""Refrigerator"", ""Paid parking on premises"", ""Mosquito net"", ""Freezer""]",$146.00,3,30,3,3,30,30,3.0,30.0,,t,0,0,0,0,2023-03-10,44,1,0,2012-01-02,2022-12-31,4.86,4.86,4.89,4.95,4.86,4.5,4.73,0363 04FA C38F 7362 8C6D,f,1,1,0,0,0.32
627188,https://www.airbnb.com/rooms/627188,20230309202119,2023-03-10,city scrape,Sleep at Amy's B'n'B Garden Room,"The rooms are freshly painted, with new laminate flooring. Each room has coffee and tea service, along with a microwave and refrigerator, and cups, plates and silverware.<br /><br />We also have a second room in this location that is a bit smaller and less expensive that looks out directly onto the beautiful Haarlemmerdijk.<br /><br />Sleep at Amy's B'n'B Front Room<br /><br />https://www.airbnb.com/rooms/608432<br /><br /><b>The space</b><br />We call our place a Bed and Beverage, as premium coffee and tea is available in your room, as well as a welcome drink in the mini fridge. We choose not to serve breakfast, as there are so many wonderful shops, cafes, restaurants and grocery stores literally steps from our front door.<br />Our BnB is located in the heart of Amsterdam on the historic Haarlemmerdijk, only a short walk from the Centraal Station.<br />The Garden Room is the larger of the two rooms with one double bed. This room faces the back and is very quiet. (This listing is for t","The Haarlemmerbuurt is a wonderful and historic neighborhood.<br />Originally, this was the main road to Haarlem- hence the name.<br />Starting at the Singel Canal, where the street is called Haarlemmerstraat, past the Eenhoornsluis (The Unicorn Lock!), it changes name to Haarlemmerdijk and continues all the way to the Haarlemmerplein<br />You will find much to see and do here. If you love shopping, eating, drinking or just sightseeing, this is the place to stay.",https://a0.muscache.com/pictures/d9fe8145-1298-47ac-89f7-f4bcf58daa18.jpg,3015785,https://www.airbnb.com/users/show/3015785,Erik And Mary Jo,2012-07-22,"Amsterdam, Netherlands",We are an American couple running a Bed and Breakfast here in Amsterdam for 10 years.,within an hour,100%,100%,t,https://a0.muscache.com/im/pictures/user/f98f78e6-133a-4abe-a8fd-62786674904d.jpg?aki_policy=profile_small,https://a0.muscache.com/im/pictures/user/f98f78e6-133a-4abe-a8fd-62786674904d.jpg?aki_policy=profile_x_medium,Westelijke Eilanden,2,2,"['email', 'phone']",t,t,"Amsterdam, Haarlemmerbuurt, Netherlands",Centrum-West,,52.381996,4.888583,Private room in bed and breakfast,Private room,2,,1 shared bath,,1.0,"[""Host greets you"", ""Hair dryer"", ""Bed linens"", ""Hot water"", ""Hot water kettle"", ""Laundromat nearby"", ""Shampoo"", ""Security cameras on property"", ""Lock on bedroom door"", ""Coffee maker"", ""Essentials"", ""Dishes and silverware"", ""Smoke alarm"", ""Wifi \u2013 21 Mbps"", ""Extra pillows and blankets"", ""Heating"", ""Coffee"", ""Private patio or balcony"", ""Carbon monoxide alarm"", ""Mini fridge"", ""Portable fans"", ""Microwave""]",$101.00,1,10,1,1,1125,1125,1.0,1125.0,,t,3,5,16,16,2023-03-10,515,87,2,2012-08-08,2023-03-06,4.85,4.91,4.85,4.97,4.97,4.93,4.72,0363 AACD 8155 9F76 50DA,f,2,0,2,0,4.0
