id,listing_url,scrape_id,last_scraped,source,name,description,neighborhood_overview,picture_url,host_id,host_url,host_name,host_since,host_location,host_about,host_response_time,host_response_rate,host_acceptance_rate,host_is_superhost,host_thumbnail_url,host_picture_url,host_neighbourhood,host_listings_count,host_total_listings_count,host_verifications,host_has_profile_pic,host_identity_verified,neighbourhood,neighbourhood_cleansed,neighbourhood_group_cleansed,latitude,longitude,property_type,room_type,accommodates,bathrooms,bathrooms_text,bedrooms,beds,amenities,price,minimum_nights,maximum_nights,minimum_minimum_nights,maximum_minimum_nights,minimum_maximum_nights,maximum_maximum_nights,minimum_nights_avg_ntm,maximum_nights_avg_ntm,calendar_updated,has_availability,availability_30,availability_60,availability_90,availability_365,calendar_last_scraped,number_of_reviews,number_of_reviews_ltm,number_of_reviews_l30d,first_review,last_review,review_scores_rating,review_scores_accuracy,review_scores_cleanliness,review_scores_checkin,review_scores_communication,review_scores_location,review_scores_value,license,instant_bookable,calculated_host_listings_count,calculated_host_listings_count_entire_homes,calculated_host_listings_count_private_rooms,calculated_host_listings_count_shared_rooms,reviews_per_month
222516,https://www.airbnb.com/rooms/222516,20230309202119,2023-03-10,previous scrape,Cosy apartment in A'dam West. Tasteful & quiet.,"Experience King’s Day in Amsterdam and stay in our bright and friendly flat.<br /><br />This apartment is best suited for single travellers or couples. We welcome all people. LGBT-friendly.<br /><br /><b>The space</b><br />We're a friendly couple that loves to welcome visitors from around the world. Our cosy apartment is tastefully decorated and very well equipped with all the comforts you might need for a wonderful stay.<br /><br />The apartment is located on the border of Oud West / De Baarsjes neighbourhoods and is excellently connected to the airport (Schiphol Amsterdam), Centraal and Zuid Stations and the city center. <br /><br />In the neighbourhood you will find:<br />* Various large supermarkets + a daily market<br />* Some of Amsterdam's best specialty coffee bars are close by. If you're really into coffee visit The Coffeevine (my personal blog) for all the best café recommendations.<br />* Some of the best nightlife in the city is close by<br />* A large variety of local stor","It's vibrant, really up and coming and very well connected. The airport is close as is the center. Only 5 minutes walk will take you to the heart of the Jan Pieter Heijestraat, Kinkerstraat, Jan Evertsenstraat and Overtoom areas that are full of bars, restaurants, coffee bars and some good shops. The center of town is about 15 / 20 minutes walk and can easily be reached on foot or by bike, tram and taxi.<br /><br />Be aware that this is NOT a city center flat. The apartment is in a residential area in Amsterdam West.",https://a0.muscache.com/pictures/miso/Hosting-222516/original/9b5f52cb-b69e-46a5-ae3f-6464e24fc348.jpeg,1155595,https://www.airbnb.com/users/show/1155595,Alex,2011-09-14,"Amsterdam, Netherlands","Hey peeps,

I've been on Airbnb for a few years now and have so far had lots of great experiences both as a host and as a traveler.
I would love to welcome you to my adopted home city and help you get the most of your time in Amsterdam.
My house is always tidy and welcoming. If you're looking for a nice place to stay, this is it!",within an hour,100%,100%,f,https://a0.muscache.com/im/pictures/user/4712a86e-c882-451e-bb60-43bcaaf9590f.jpg?aki_policy=profile_small,https://a0.muscache.com/im/pictures/user/4712a86e-c882-451e-bb60-43bcaaf9590f.jpg?aki_policy=profile_x_medium,,1,1,"['email', 'phone', 'work_email']",t,t,"Amsterdam, North Holland, Netherlands",De Baarsjes - Oud-West,,52.36271,4.85875,Entire rental unit,Entire home/apt,2,,1.5 baths,1.0,1.0,"[""Wifi"", ""43\"" HDTV with Amazon Prime Video, HBO Max, Netflix, standard cable"", ""Hair dryer"", ""Luggage dropoff allowed"", ""Free washer \u2013 In unit"", ""Hot water"", ""Free dryer \u2013 In unit"", ""Cooking basics"", ""Self check-in"", ""Kitchen"", ""Stove"", ""Shampoo"", ""Lockbox"", ""Coffee maker"", ""Essentials"", ""Dishes and silverware"", ""Smoke alarm"", ""Paid parking off premises"", ""Iron"", ""Dishwasher"", ""Heating"", ""Private patio or balcony"", ""Fire extinguisher"", ""Carbon monoxide alarm"", ""Oven"", ""Refrigerator"", ""Portable air conditioning"", ""Microwave""]",$119.00,3,21,3,3,1125,1125,3.0,1125.0,,t,0,0,0,0,2023-03-10,139,4,0,2011-10-17,2022-09-05,4.71,4.82,4.77,4.87,4.88,4.54,4.54,0363 6ADC 900E 6878 AC7C,f,1,1,0,0,1.0
568446,https://www.airbnb.com/rooms/568446,20230309202119,2023-03-10,previous scrape,Pretty apt in the center of A'dam,"registration no.: 0363 2BD0 289D BF51 4A09<br />A lovely maisonette with complete privacy,  in the true heart of Amsterdam. If you like urban life, you'll enjoy it :)<br /><br />* NOTE<br />Please inform us your arrival time (at airport or Centraal station) when you send an inquiry or booking request. It will make us much faster to reply you about availability. Thank you!<br /><br /><b>The space</b><br />Truly at the heart of Amsterdam, just off Nieuwmarkt, super convenient location. In walking distance are Waterloo Plein, Rembrandt House, Zeedijk (China town), Red Right district, Damplein and Palace. Bunch of cafes, shops and good restaurants in the neigbourhood. 10 minutes walk or 1 stop by metro from the Central station. From there it is only 20 minutes to the Airport. <br /><br />The apartment is a maisonette (double-floor) <br />Downstairs are living room with a a sofa-bed (140 x 200cm), and an open kitchen with a dishwasher, refrigerator and oven-microwave.  <br />Upstairs are be",,https://a0.muscache.com/pictures/7019622/a16cf636_original.jpg,2797260,https://www.airbnb.com/users/show/2797260,Noriko,2012-07-01,"Amsterdam, Netherlands","Hi. I love my apartment. If you like urban life, you'll enjoy the location. ",within a day,100%,46%,f,https://a0.muscache.com/im/users/2797260/profile_pic/1341166816/original.jpg?aki_policy=profile_small,https://a0.muscache.com/im/users/2797260/profile_pic/1341166816/original.jpg?aki_policy=profile_x_medium,Nieuwmarkt en Lastage,1,1,"['email', 'phone']",t,t,,Centrum-Oost,,52.37079,4.90153,Entire rental unit,Entire home/apt,3,,1 bath,1.0,2.0,"[""Hot tub"", ""Host greets you"", ""Wifi"", ""Washer"", ""Hair dryer"", ""Luggage dropoff allowed"", ""Bed linens"", ""Hot water"", ""Hot water kettle"", ""Cooking basics"", ""Kitchen"", ""Stove"", ""Long term stays allowed"", ""Coffee maker"", ""Essentials"", ""Dishes and silverware"", ""Bathtub"", ""Iron"", ""Extra pillows and blankets"", ""Private entrance"", ""Dishwasher"", ""Heating"", ""Fire extinguisher"", ""First aid kit"", ""Hangers"", ""Oven"", ""Smoking allowed"", ""Refrigerator"", ""Microwave"", ""Patio or balcony""]",$150.00,3,5,3,3,5,5,3.0,5.0,,t,0,0,0,0,2023-03-10,109,3,0,2012-09-08,2022-08-04,4.82,4.75,4.57,4.87,4.88,4.92,4.64,0363 2BD0 289D BF51 4A09,f,1,1,0,0,0.85
570753,https://www.airbnb.com/rooms/570753,20230309202119,2023-03-09,city scrape,Southern Comfort near Vondelpark,"<b>The space</b><br />I can offer you a beautiful, large room in an attractive house built in <br />1910 in the green area of Old South. With balcony. Located on the first floor of my apartment.<br /><br />The room is nicely decorated with a warm southern atmosphere.<br />Wi-Fi, DVD, TV, fridge, coffee/tea facilities are available.<br />There is a comfortable double bed and a possibility for an extra aero bed. <br />The bathroom is decorated in Mexican style, only shared with me<br /> <br />You can use my kitchen at the ground  floor only for washing dishes and microwave. <br /><br />I am sorry, no pets allowed. And smoking only on balcony.<br /><br />The supermarket is at the corner and nice small shops are nearby for everything you need. So you can easily take your breakfast at your balcony.<br />There are also several good places and terraces nearby for breakfast, lunch and dinner. Especially Gent aan de Schinkel is great for a romantic dinner on the terrace at the canal with a lot ",,https://a0.muscache.com/pictures/7507473/f870c3e5_original.jpg,2439449,https://www.airbnb.com/users/show/2439449,Henriette,2012-05-22,"Amsterdam, Netherlands","Hello,

I am Henriette, living in Amsterdam since 1983 on several places.
I was born in Eindhoven, in the South of Holland and studied at the University of Nijmegen and Amsterdam, political science and film-science.

Many years I worked as a film/video/performance programmer in theatres. 
Since 1990 I am working as a TV journalist and now for many years for a current affairs program. 

I love my work. And I really enjoy going to arthouse movies, experimental cinema, music and dance.  
Traveling and seeing other cultures makes me happy, as well as meeting my family, eating with friends and biking with my partner.

I already have a B&B since 1999.  I like it so much : it enriches my life meeting all kinds of different people. 



",within a day,100%,65%,t,https://a0.muscache.com/im/users/2439449/profile_pic/1341766924/original.jpg?aki_policy=profile_small,https://a0.muscache.com/im/users/2439449/profile_pic/1341766924/original.jpg?aki_policy=profile_x_medium,Stadionbuurt,1,2,"['email', 'phone']",t,t,,Zuid,,52.34904,4.86765,Private room in bed and breakfast,Private room,3,,1.5 shared baths,1.0,2.0,"[""Bathtub"", ""Host greets you"", ""Wifi"", ""Hangers"", ""Iron"", ""Refrigerator"", ""Hair dryer"", ""Extra pillows and blankets"", ""Shampoo"", ""Heating"", ""Bed linens"", ""Lock on bedroom door"", ""Coffee maker"", ""Essentials"", ""TV with standard cable""]",$90.00,4,30,4,4,30,30,4.0,30.0,,t,0,0,1,104,2023-03-09,380,11,0,2012-07-28,2023-02-04,4.87,4.92,4.94,4.94,4.91,4.84,4.79,0363 7215 8083 16CB E805,f,1,0,1,0,2.94
245927,https://www.airbnb.com/rooms/245927,20230309202119,2023-03-10,city scrape,Sonnenberg - Canal side & view - Private & Central,"This unique property is a 16th century canal house. With private entrance and exclusive use of two whole floors.<br /><br />The owner lives on the bottom two floors of the house, so is always close-by to assist and help out with tips and recommendations. It also means no-party policy is strictly observed.<br /><br />The seating lounge area is warm and cozy, and has awesome views of the most beautiful canal of Amsterdam.<br /><br />We provide limited cooking facilities; please read description of space for more information.<br /><br /><b>The space</b><br />Sonnenberg is located on the Herengracht, in the historic centre of Amsterdam. Surrounded by the famous nine-streets, this historic canal house was built in 1649 for the Sonnenberg family. It is one of the few houses that still boast its original gable, which is a classical renaissance crow-stepped gable; this is a stair-step type of design at the top of the triangular gable-end of a building.<br /><br />Not only the gable is still or",The view from the apartment of the most beautiful canal is already awesome. But to be in the nine-streets area of the city means the coolest shops and restaurants are a literal stones-throw away.,https://a0.muscache.com/pictures/5a410698-dd67-4943-8994-6d76919f7950.jpg,1005087,https://www.airbnb.com/users/show/1005087,Wytse,2011-08-22,"Amsterdam, Netherlands","I grew up in the hospitality business, with my parents running hotels and/or restaurants. 

I love to share my experience of the wonderful city of Amsterdam. In my opinion the best way to see the city is with friends on an open canal boat on a nice day or evening.",within an hour,100%,100%,t,https://a0.muscache.com/im/pictures/user/7f219fe4-00eb-4e34-8e6b-efd1ae0ef68e.jpg?aki_policy=profile_small,https://a0.muscache.com/im/pictures/user/7f219fe4-00eb-4e34-8e6b-efd1ae0ef68e.jpg?aki_policy=profile_x_medium,Grachtengordel,1,3,"['email', 'phone']",t,t,"Amsterdam, North Holland, Netherlands",Centrum-West,,52.36815,4.88604,Entire guest suite,Entire home/apt,4,,1.5 baths,2.0,3.0,"[""Drying rack for clothing"", ""Host greets you"", ""Room-darkening shades"", ""Clothing storage: wardrobe, closet, and dresser"", ""Waterfront"", ""Marie-Stella-Maris conditioner"", ""Hair dryer"", ""Luggage dropoff allowed"", ""Marie-Stella-Maris body soap"", ""Bed linens"", ""Hot water"", ""Cleaning products"", ""Hot water kettle"", ""Cooking basics"", ""City skyline view"", ""High chair"", ""Laundromat nearby"", ""Toaster"", ""Dining table"", ""Dedicated workspace"", ""Babysitter recommendations"", ""Cleaning available during stay"", ""Coffee maker"", ""Essentials"", ""Dishes and silverware"", ""Smoke alarm"", ""Paid parking off premises"", ""Bathtub"", ""Wine glasses"", ""Children\u2019s books and toys for ages 0-2 years old, 2-5 years old, and 5-10 years old"", ""Iron"", ""Safe"", ""Fast wifi \u2013 644 Mbps"", ""Extra pillows and blankets"", ""Private entrance"", ""Shower gel"", ""Books and reading material"", ""Heating"", ""Dishwasher"", ""Coffee"", ""Marie-Stella-Maris shampoo"", ""Fire extinguisher"", ""Carbon monoxide alarm"", ""First aid kit"", ""Canal view"", ""Crib"", ""Hangers"", ""46\"" HDTV with Apple TV, standard cable"", ""Mini fridge"", ""Oven"", ""Refrigerator"", ""Pack \u2019n play/Travel crib"", ""Portable fans"", ""Microwave"", ""Ethernet connection""]",$561.00,2,180,2,5,1125,1125,3.2,1125.0,,t,4,7,9,232,2023-03-10,176,41,3,2012-04-29,2023-03-02,4.84,4.89,4.88,4.87,4.89,4.98,4.63,0363 E3FA A6F6 2112 7636,t,1,1,0,0,1.33
575603,https://www.airbnb.com/rooms/575603,20230309202119,2023-03-10,previous scrape,Loft right in the city centre,"An extraordinary space right in the city centre. Around the corner of the Heineken brewery.<br /><br /><b>The space</b><br />This is your chance to enjoy the centre of Amsterdam from a unique location. <br />As part of a former catholic school building, built in 1907, our apartment – located in the former gymnasium – has a modern interior style. Next to its immense living with an entresol, the 220m2 / 2400ft2 completely furnished property has 4 bedrooms and features:<br />Open kitchen <br />6 pits stove with double oven <br />Microwave <br />Refrigerator / freezer<br />Dishwasher<br />Espresso machine <br />Broadband Internet<br />110 cm flatscreen<br />DTV, VD and VCR<br />Piano<br />Wooden floor<br />4 bedrooms, one kingsize, one French, one queensize, one bunk bed <br />2 Bathrooms with shower, one with bathtub<br />2 separate toilettes<br />Storage room with washing machine / dryer <br />Garden<br /><br />Minimum rental period is a week!<br /><br /><b>Guest access</b><br />You will","This property is located in the city centre of Amsterdam, close to the Heineken Brewery. The historical center is one the most desired areas of Amsterdam. It is the vibrant heart of the city with a vast choice of restaurants, cafés, and clubs. Specialty shops are abundant in the many narrow streets and the city's famous architecture can best be viewed by a stroll along the canals or a boat tour. Parking garages can be found close by.",https://a0.muscache.com/pictures/52497575/296a60e8_original.jpg,2830952,https://www.airbnb.com/users/show/2830952,Henning,2012-07-04,"Amsterdam, Netherlands","Being married to a Mexican, our family divides their time between Amsterdam, The Netherlands and Oaxaca, Mexico.
I am currently chairing the foundation of Children of Mexico, a Dutch based fundraiser supporting Mexican organisations that help street children through education. Please check our website Children of Mexico www childrenofmexico net
",within an hour,100%,67%,f,https://a0.muscache.com/im/pictures/user/7add6fa8-d6cc-4c69-bd53-b7ae1b41f18a.jpg?aki_policy=profile_small,https://a0.muscache.com/im/pictures/user/7add6fa8-d6cc-4c69-bd53-b7ae1b41f18a.jpg?aki_policy=profile_x_medium,Grachtengordel,3,4,"['email', 'phone', 'work_email']",t,t,"Amsterdam, North Holland, Netherlands",Centrum-Oost,,52.36112,4.89462,Entire loft,Entire home/apt,4,,2.5 baths,4.0,4.0,"[""Board games"", ""Wifi"", ""Children\u2019s dinnerware"", ""Washer"", ""Blender"", ""Hair dryer"", ""Luggage dropoff allowed"", ""Outdoor furniture"", ""Bed linens"", ""Hot water"", ""Hot water kettle"", ""Cooking basics"", ""Kitchen"", ""Toaster"", ""Dining table"", ""Dedicated workspace"", ""Record player"", ""Kenwood sound system with aux"", ""Stove"", ""Coffee maker"", ""Essentials"", ""Dishes and silverware"", ""Smoke alarm"", ""Outdoor dining area"", ""Bathtub"", ""Wine glasses"", ""Iron"", ""Extra pillows and blankets"", ""Private entrance"", ""Heating"", ""Dishwasher"", ""Coffee"", ""Backyard"", ""TV with standard cable"", ""Fire extinguisher"", ""BBQ grill"", ""Carbon monoxide alarm"", ""First aid kit"", ""Paid street parking off premises"", ""Crib"", ""Hangers"", ""Oven"", ""Dryer"", ""Hammock"", ""Refrigerator"", ""Portable fans"", ""Microwave"", ""Patio or balcony"", ""Piano"", ""Freezer""]",$245.00,5,35,5,5,35,35,5.0,35.0,,t,0,0,0,0,2023-03-10,20,3,0,2014-07-30,2023-01-04,4.85,4.8,4.85,4.89,5.0,4.95,4.74,0363 6703 A9A1 6C28 ECD5,f,2,2,0,0,0.19
579851,https://www.airbnb.com/rooms/579851,20230309202119,2023-03-10,city scrape,Private Studio on Spectacular Houseboat,"We were able to build our dream. A unique, modern and comfortable houseboat of 35 x 6 meters. We designed an independent private studio in the bow of the boat that can be your's for a few days. So you can share our experience of living the good life on the water. My husband Michael and I live on the other side of the boat.<br /><br /><b>The space</b><br />The nautical boutique style studio is situated in the bow of houseboat ""Tasmania"". You get your own private space with a private entrance and en-suite bathroom with great shower and toilet. It has underfloor heating and is cosy and warm in the wintertime.<br /><br />From the bed, you can look at the stars or the full moon. On the private deck you can enjoy a glass of wine and watch the sunset and the beautiful row of old seventeenth century warehouses. <br />The Tasmania lies at the edge of the city centre in the old woodharbor, a secret hideaway just around the corner of the bustling city centre. Quiet and beautiful, it is situated i",We live in a sheltered harbour just minutes away from the city centre. In the summer we see the sun rise on the port side and the sun set on the starboard side. You can enjoy the sun here alle day. We swim here all summer long and paddle our kayaks. There is also a lot of paddle boarding going on (we don't own one) and lot's of mall boats passing by. There are 2 electrical boat rentals very nearby.,https://a0.muscache.com/pictures/1b60ed57-ccf4-406f-8edb-17a2b5c62ea7.jpg,2851886,https://www.airbnb.com/users/show/2851886,Sonja,2012-07-06,"Amsterdam, Netherlands","Many guests have asked: ""What was this boat before you reconverted it?"" The answer is simple: it didn't exist. It was custom build. In October 2011 the ""Tasmania"" arrived in Amsterdam. Our dream came true and we would love to share that dream with you. 

We are hard working film and television professionals. Before building this boat we used to travel a lot. Now every day feels like a holiday. When we are at home we'll be happy to welcome you and tell you everything you want to know about Amsterdam and the boat. But most of the time we're out working. It will make your stay more private. We hope the studio apartment appeals to people who like to travel independent, just like us.

Favorite travel destination: Namibia
Favorite movies: De Rouille et d'Os, Heat, Das Weisse Band and many more.
Favorite Filmfestival: International Documentary Festival Amsterdam (IDFA)
Favorite Music Festivals: Amsterdam Dance Event, North Sea Jazz Festival
Favorite books: Story of a Life by Paustovsky, Innumeracy by Paulos
Favorite food: Mediterranean
Favorite drink: wine, wine, wine. Soon finishing studies at the Wineacademy",within an hour,100%,100%,t,https://a0.muscache.com/im/users/2851886/profile_pic/1343330398/original.jpg?aki_policy=profile_small,https://a0.muscache.com/im/users/2851886/profile_pic/1343330398/original.jpg?aki_policy=profile_x_medium,Spaarndammer en Zeeheldenbuurt,1,1,"['email', 'phone']",t,t,"Amsterdam, North Holland, Netherlands",Westerpark,,52.39144,4.88436,Private room in guest suite,Private room,2,,1 private bath,1.0,1.0,"[""Wifi"", ""Waterfront"", ""Hair dryer"", ""Luggage dropoff allowed"", ""Bed linens"", ""Hot water"", ""Hot water kettle"", ""Cooking basics"", ""Self check-in"", ""Dining table"", ""Dedicated workspace"", ""Shampoo"", ""Long term stays allowed"", ""Lock on bedroom door"", ""Coffee maker"", ""Essentials"", ""Dishes and silverware"", ""Smoke alarm"", ""Paid parking off premises"", ""Extra pillows and blankets"", ""Private entrance"", ""Keypad"", ""Shower gel"", ""Heating"", ""Private living room"", ""Coffee"", ""Private patio or balcony"", ""Fire extinguisher"", ""Carbon monoxide alarm"", ""Hangers"", ""Mini fridge"", ""HDTV with Netflix, standard cable"", ""Oven"", ""Microwave""]",$149.00,2,31,2,2,31,31,2.0,31.0,,t,6,7,7,42,2023-03-10,544,52,2,2012-10-09,2023-02-22,4.96,4.96,4.97,4.97,4.96,4.79,4.86,0363 74BB 1569 D1B7 ADBE,f,1,0,1,0,4.29
582028,https://www.airbnb.com/rooms/582028,20230309202119,2023-03-09,city scrape,Quiet large park side apartment for 2 adults 1 kid,"Want to enjoy the vibrant city of Amsterdam and get some proper rest at night? Then this is your ideal place! Our colourful apartment is at a large,  quiet park. Conveniently near public transport it's a short distance to the heart of Amsterdam.<br />>> We have a brand new floor and fresh paint on the walls. Pictures are available on request! >><br /><br /><b>The space</b><br />Want to stay safely in a spacious & bright apartment in the largest park of Amsterdam?<br /><br />Many people mistake the Vondelpark to be the largest park we have. Although it's far from New York's Central Park, our apartment has its ground on the border of the Rembrandtpark. It's not only larger but also really peaceful as most locals and tourists don't bother visiting it. That means you will we able to enjoy the view without the noise!<br /><br />Location:<br />Our apartment is located on the West border of the lovely Amsterdam Zuid district. Closed off by the city's speedway on one side and the park on the o",,https://a0.muscache.com/pictures/f506dd7f-d4d4-4b08-9c6b-fbcc1d0f0be1.jpg,2865851,https://www.airbnb.com/users/show/2865851,Oliver,2012-07-08,"Amsterdam, Netherlands","Happy-go-lucky 30 something trying to enjoy life to the fullest. You can find me smiling 90 percent of the day, after I had my first shot of caffeine. Working in social media I like to connect to (new) people all the time - online and offline. 

I love to share the beauty of Amsterdam with others, so don't hesitate to ask me anything!",within an hour,100%,67%,f,https://a0.muscache.com/im/pictures/user/55f839af-3ddf-4683-8423-38441d6d1546.jpg?aki_policy=profile_small,https://a0.muscache.com/im/pictures/user/55f839af-3ddf-4683-8423-38441d6d1546.jpg?aki_policy=profile_x_medium,,1,1,"['email', 'phone']",t,t,,Slotervaart,,52.36022,4.84346,Entire rental unit,Entire home/apt,3,,1.5 baths,1.0,1.0,"[""Host greets you"", ""Wifi"", ""Children\u2019s dinnerware"", ""Hair dryer"", ""TV with Netflix, standard cable"", ""Free washer \u2013 In unit"", ""Outdoor furniture"", ""Hot water"", ""Free dryer \u2013 In unit"", ""Cooking basics"", ""City skyline view"", ""High chair"", ""Kitchen"", ""Park view"", ""Baby bath"", ""Dedicated workspace"", ""Children\u2019s books and toys"", ""Shampoo"", ""Coffee maker"", ""Essentials"", ""Dishes and silverware"", ""Smoke alarm"", ""Paid parking off premises"", ""Changing table"", ""Elevator"", ""Siemens stainless steel gas stove"", ""Iron"", ""Heating"", ""Dishwasher"", ""Private patio or balcony"", ""Fire extinguisher"", ""First aid kit"", ""Oven"", ""Refrigerator"", ""Pack \u2019n play/Travel crib"", ""Portable air conditioning"", ""Microwave""]",$135.00,7,28,7,7,28,28,7.0,28.0,,t,1,1,3,79,2023-03-09,11,1,0,2013-09-24,2022-06-17,4.82,4.91,4.82,4.55,5.0,4.27,4.45,0363 6AE3 C6BD AA79 AB13,f,1,1,0,0,0.1
